Movie_Name,Movie_Poster,Movie_Description
Logan,"https://m.media-amazon.com/images/M/MV5BYzc5MTU4N2EtYTkyMi00NjdhLTg3NWEtMTY4OTEyMzJhZTAzXkEyXkFqcGdeQXVyNjc1NTYyMjg@._V1_UX67_CR0,0,67,98_AL_.jpg","In a future where mutants are nearly extinct, an elderly and weary Logan leads a quiet life. But when Laura, a mutant child pursued by scientists, comes to him for help, he must get her to safety."
Room,"https://m.media-amazon.com/images/M/MV5BMjE4NzgzNzEwMl5BMl5BanBnXkFtZTgwMTMzMDE0NjE@._V1_UX67_CR0,0,67,98_AL_.jpg","Held captive for 7 years in an enclosed space, a woman and her young son finally gain their freedom, allowing the boy to experience the outside world for the first time."
Tangerines,"https://m.media-amazon.com/images/M/MV5BMTgwNzA3MDQzOV5BMl5BanBnXkFtZTgwNTE5MDE5NDE@._V1_UX67_CR0,0,67,98_AL_.jpg","In 1992, war rages in Abkhazia, a breakaway region of Georgia. An Estonian man Ivo has decided to stay behind and harvest his crops of tangerines. In a bloody conflict at his door, a wounded man is left behind, and Ivo takes him in."
Soul,"https://m.media-amazon.com/images/M/MV5BZGE1MDg5M2MtNTkyZS00MTY5LTg1YzUtZTlhZmM1Y2EwNmFmXkEyXkFqcGdeQXVyNjA3OTI0MDc@._V1_UX67_CR0,0,67,98_AL_.jpg","After landing the gig of a lifetime, a New York jazz pianist suddenly finds himself trapped in a strange land between Earth and the afterlife."
Special Chabbis,"https://m.media-amazon.com/images/M/MV5BMTQ1NDI5MjMzNF5BMl5BanBnXkFtZTcwMTc0MDQwOQ@@._V1_UY98_CR0,0,67,98_AL_.jpg",A gang of con-men rob prominent rich businessmen and politicians by posing as C.B.I and income tax officers.
The Grand Budapest Hotel,"https://m.media-amazon.com/images/M/MV5BMzM5NjUxOTEyMl5BMl5BanBnXkFtZTgwNjEyMDM0MDE@._V1_UX67_CR0,0,67,98_AL_.jpg","A writer encounters the owner of an aging high-class hotel, who tells him of his early years serving as a lobby boy in the hotel's glorious years under an exceptional concierge."
Gone Girl,"https://m.media-amazon.com/images/M/MV5BMTk0MDQ3MzAzOV5BMl5BanBnXkFtZTgwNzU1NzE3MjE@._V1_UX67_CR0,0,67,98_AL_.jpg","With his wife's disappearance having become the focus of an intense media circus, a man sees the spotlight turned on him when it's suspected that he may not be innocent."
Hacksaw Ridge,"https://m.media-amazon.com/images/M/MV5BMjQ1NjM3MTUxNV5BMl5BanBnXkFtZTgwMDc5MTY5OTE@._V1_UX67_CR0,0,67,98_AL_.jpg","World War II American Army Medic Desmond T. Doss, who served during the Battle of Okinawa, refuses to kill people and becomes the first man in American history to receive the Medal of Honor without firing a shot."
12 Years a Slave,"https://m.media-amazon.com/images/M/MV5BMjExMTEzODkyN15BMl5BanBnXkFtZTcwNTU4NTc4OQ@@._V1_UX67_CR0,0,67,98_AL_.jpg","In the antebellum United States, Solomon Northup, a free black man from upstate New York, is abducted and sold into slavery."
Guardians of the Galaxy,"https://m.media-amazon.com/images/M/MV5BMTAwMjU5OTgxNjZeQTJeQWpwZ15BbWU4MDUxNDYxODEx._V1_UX67_CR0,0,67,98_AL_.jpg",A group of intergalactic criminals must pull together to stop a fanatical warrior with plans to purge the universe.
Rush,"https://m.media-amazon.com/images/M/MV5BOWEwODJmZDItYTNmZC00OGM4LThlNDktOTQzZjIzMGQxODA4XkEyXkFqcGdeQXVyNjU0OTQ0OTY@._V1_UX67_CR0,0,67,98_AL_.jpg",The merciless 1970s rivalry between Formula One rivals James Hunt and Niki Lauda.
Ford v Ferrari,"https://m.media-amazon.com/images/M/MV5BM2UwMDVmMDItM2I2Yi00NGZmLTk4ZTUtY2JjNTQ3OGQ5ZjM2XkEyXkFqcGdeQXVyMTA1OTYzOTUx._V1_UX67_CR0,0,67,98_AL_.jpg",American car designer Carroll Shelby and driver Ken Miles battle corporate interference and the laws of physics to build a revolutionary race car for Ford in order to defeat Ferrari at the 24 Hours of Le Mans in 1966.
Spotlight,"https://m.media-amazon.com/images/M/MV5BMjIyOTM5OTIzNV5BMl5BanBnXkFtZTgwMDkzODE2NjE@._V1_UX67_CR0,0,67,98_AL_.jpg","The true story of how the Boston Globe uncovered the massive scandal of child molestation and cover-up within the local Catholic Archdiocese, shaking the entire Catholic Church to its core."
Song of the Sea,"https://m.media-amazon.com/images/M/MV5BMTQ2MDMwNjEwNV5BMl5BanBnXkFtZTgwOTkxMzI0MzE@._V1_UY98_CR0,0,67,98_AL_.jpg","Ben, a young Irish boy, and his little sister Saoirse, a girl who can turn into a seal, go on an adventure to free the fairies and save the spirit world."
The Help,"https://m.media-amazon.com/images/M/MV5BMTM5OTMyMjIxOV5BMl5BanBnXkFtZTcwNzU4MjIwNQ@@._V1_UX67_CR0,0,67,98_AL_.jpg","An aspiring author during the civil rights movement of the 1960s decides to write a book detailing the African American maids' point of view on the white families for which they work, and the hardships they go through on a daily basis."
Prisoners,"https://m.media-amazon.com/images/M/MV5BMTg0NTIzMjQ1NV5BMl5BanBnXkFtZTcwNDc3MzM5OQ@@._V1_UX67_CR0,0,67,98_AL_.jpg","When Keller Dover's daughter and her friend go missing, he takes matters into his own hands as the police pursue multiple leads and the pressure mounts."
Mad Max: Fury Road,"https://m.media-amazon.com/images/M/MV5BN2EwM2I5OWMtMGQyMi00Zjg1LWJkNTctZTdjYTA4OGUwZjMyXkEyXkFqcGdeQXVyMTMxODk2OTU@._V1_UX67_CR0,0,67,98_AL_.jpg","In a post-apocalyptic wasteland, a woman rebels against a tyrannical ruler in search for her homeland with the aid of a group of female prisoners, a psychotic worshiper, and a drifter named Max."
A Wednesday,"https://m.media-amazon.com/images/M/MV5BOTcwMzdiMWItMjZlOS00MzAzLTg5OTItNTA4OGYyMjBhMmRiXkEyXkFqcGdeQXVyODE5NzE3OTE@._V1_UY98_CR1,0,67,98_AL_.jpg",A retiring police officer reminisces about the most astounding day of his career. About a case that was never filed but continues to haunt him in his memories - the case of a man and a Wednesday.
Zack Snyder's Justice League,"https://m.media-amazon.com/images/M/MV5BYjI3NDg0ZTEtMDEwYS00YWMyLThjYjktMTNlM2NmYjc1OGRiXkEyXkFqcGdeQXVyMTEyMjM2NDc2._V1_UX67_CR0,0,67,98_AL_.jpg","Determined to ensure Superman's ultimate sacrifice was not in vain, Bruce Wayne aligns forces with Diana Prince with plans to recruit a team of metahumans to protect the world from an approaching threat of catastrophic proportions."
Dune: Part One,"https://m.media-amazon.com/images/M/MV5BN2FjNmEyNWMtYzM0ZS00NjIyLTg5YzYtYThlMGVjNzE1OGViXkEyXkFqcGdeQXVyMTkxNjUyNQ@@._V1_UX67_CR0,0,67,98_AL_.jpg",Feature adaptation of Frank Herbert's science fiction novel about the son of a noble family entrusted with the protection of the most valuable asset and most vital element in the galaxy.
CODA,"https://m.media-amazon.com/images/M/MV5BNGNmMzJjMTItODA0OC00ZWM0LWJmMTctMDg3MzM2M2Y5NTIyXkEyXkFqcGdeQXVyMDM2NDM2MQ@@._V1_UX67_CR0,0,67,98_AL_.jpg","As a CODA (Child of Deaf Adults) Ruby is the only hearing person in her deaf family. When the family's fishing business is threatened, Ruby finds herself torn between pursuing her love of music by wanting to go to Berklee College of Music and her fear of abandoning her parents."
Hachi: A Dog's Tale,"https://m.media-amazon.com/images/M/MV5BNzE4NDg5OWMtMzg3NC00ZDRjLTllMDMtZTRjNWZmNjBmMGZlXkEyXkFqcGdeQXVyMTMxODk2OTU@._V1_UY98_CR1,0,67,98_AL_.jpg",A college professor bonds with an abandoned dog he takes into his home.
Mary and Max.,"https://m.media-amazon.com/images/M/MV5BMDgzYjQwMDMtNGUzYi00MTRmLWIyMGMtNjE1OGZkNzY2YWIzL2ltYWdlXkEyXkFqcGdeQXVyNjU0OTQ0OTY@._V1_UY98_CR1,0,67,98_AL_.jpg","A tale of friendship between two unlikely pen pals: Mary, a lonely, eight-year-old girl living in the suburbs of Melbourne, and Max, a forty-four-year old, severely obese man living in New York."
How to Train Your Dragon,"https://m.media-amazon.com/images/M/MV5BMjA5NDQyMjc2NF5BMl5BanBnXkFtZTcwMjg5ODcyMw@@._V1_UX67_CR0,0,67,98_AL_.jpg","A hapless young Viking who aspires to hunt dragons becomes the unlikely friend of a young dragon himself, and learns there may be more to the creatures than he assumed."
The Avengers,"https://m.media-amazon.com/images/M/MV5BNDYxNjQyMjAtNTdiOS00NGYwLWFmNTAtNThmYjU5ZGI2YTI1XkEyXkFqcGdeQXVyMTMxODk2OTU@._V1_UX67_CR0,0,67,98_AL_.jpg",Earth's mightiest heroes must come together and learn to fight as a team if they are going to stop the mischievous Loki and his alien army from enslaving humanity.
Into the Wild,"https://m.media-amazon.com/images/M/MV5BMTAwNDEyODU1MjheQTJeQWpwZ15BbWU2MDc3NDQwNw@@._V1_UX67_CR0,0,67,98_AL_.jpg","After graduating from Emory University, top student and athlete Christopher McCandless abandons his possessions, gives his entire $24,000 savings account to charity and hitchhikes to Alaska to live in the wilderness. Along the way, Christopher encounters a series of characters that shape his life."
Million Dollar Baby,"https://m.media-amazon.com/images/M/MV5BMTkxNzA1NDQxOV5BMl5BanBnXkFtZTcwNTkyMTIzMw@@._V1_UX67_CR0,0,67,98_AL_.jpg",A determined woman works with a hardened boxing trainer to become a professional.
Hotel Rwanda,"https://m.media-amazon.com/images/M/MV5BZGJjYmIzZmQtNWE4Yy00ZGVmLWJkZGEtMzUzNmQ4ZWFlMjRhXkEyXkFqcGdeQXVyMTMxODk2OTU@._V1_UX67_CR0,0,67,98_AL_.jpg","Paul Rusesabagina, a hotel manager, houses over a thousand Tutsi refugees during their struggle against the Hutu militia in Rwanda, Africa."
G.O.R.A.,"https://m.media-amazon.com/images/M/MV5BMjE0MTY2MDI3NV5BMl5BanBnXkFtZTcwNTc1MzEzMQ@@._V1_UY98_CR2,0,67,98_AL_.jpg",A slick young Turk kidnapped by extraterrestrials shows his great « humanitarian spirit » by outwitting the evil commander-in-chief of the planet of G.O.R.A.
Ratatouille,"https://m.media-amazon.com/images/M/MV5BMTMzODU0NTkxMF5BMl5BanBnXkFtZTcwMjQ4MzMzMw@@._V1_UX67_CR0,0,67,98_AL_.jpg",A rat who can cook makes an unusual alliance with a young kitchen worker at a famous Paris restaurant.
Before Sunset,"https://m.media-amazon.com/images/M/MV5BMTQ1MjAwNTM5Ml5BMl5BanBnXkFtZTYwNDM0MTc3._V1_UX67_CR0,0,67,98_AL_.jpg","Nine years after Jesse and Celine first met, they encounter each other again on the French leg of Jesse's book tour."
Pirates of the Caribbean: The Curse of the Black Pearl,"https://m.media-amazon.com/images/M/MV5BNGYyZGM5MGMtYTY2Ni00M2Y1LWIzNjQtYWUzM2VlNGVhMDNhXkEyXkFqcGdeQXVyMTMxODk2OTU@._V1_UX67_CR0,0,67,98_AL_.jpg","Blacksmith Will Turner teams up with eccentric pirate ""Captain"" Jack Sparrow to save his love, the governor's daughter, from Jack's former pirate allies, who are now undead."
The Incredibles,"https://m.media-amazon.com/images/M/MV5BMTY5OTU0OTc2NV5BMl5BanBnXkFtZTcwMzU4MDcyMQ@@._V1_UX67_CR0,0,67,98_AL_.jpg","A family of undercover superheroes, while trying to live the quiet suburban life, are forced into action to save the world."
Catch Me If You Can,"https://m.media-amazon.com/images/M/MV5BMTY5MzYzNjc5NV5BMl5BanBnXkFtZTYwNTUyNTc2._V1_UX67_CR0,0,67,98_AL_.jpg","Barely 21 yet, Frank is a skilled forger who has passed as a doctor, lawyer and pilot. FBI agent Carl becomes obsessed with tracking down the con man, who only revels in the pursuit."
"Monsters, Inc.","https://m.media-amazon.com/images/M/MV5BMTY1NTI0ODUyOF5BMl5BanBnXkFtZTgwNTEyNjQ0MDE@._V1_UX67_CR0,0,67,98_AL_.jpg","In order to power the city, monsters have to scare children so that they scream. However, the children are toxic to the monsters, and after a child gets through, two monsters realize things may not be what they think."
Lagaan: Once Upon a Time in India,"https://m.media-amazon.com/images/M/MV5BNDYxNWUzZmYtOGQxMC00MTdkLTkxOTctYzkyOGIwNWQxZjhmXkEyXkFqcGdeQXVyNjU0OTQ0OTY@._V1_UX67_CR0,0,67,98_AL_.jpg",The people of a small village in Victorian India stake their future on a game of cricket against their ruthless British rulers.
The Iron Giant,"https://m.media-amazon.com/images/M/MV5BMjIxNDU2Njk0OV5BMl5BanBnXkFtZTgwODc3Njc3NjE@._V1_UX67_CR0,0,67,98_AL_.jpg",A young boy befriends a giant robot from outer space that a paranoid government agent wants to destroy.
The Big Lebowski,"https://m.media-amazon.com/images/M/MV5BMTQ0NjUzMDMyOF5BMl5BanBnXkFtZTgwODA1OTU0MDE@._V1_UX67_CR0,0,67,98_AL_.jpg","Ultimate L.A. slacker Jeff ""The Dude"" Lebowski, mistaken for a millionaire of the same name, seeks restitution for a rug ruined by debt collectors, enlisting his bowling buddies for help while trying to find the millionaire's missing wife."
Fargo,"https://m.media-amazon.com/images/M/MV5BNDJiZDgyZjctYmRjMS00ZjdkLTkwMTEtNGU1NDg3NDQ0Yzk1XkEyXkFqcGdeQXVyNzkwMjQ5NzM@._V1_UX67_CR0,0,67,98_AL_.jpg",Minnesota car salesman Jerry Lundegaard's inept crime falls apart due to his and his henchmen's bungling and the persistent police work of the quite pregnant Marge Gunderson.
Underground,"https://m.media-amazon.com/images/M/MV5BNzI4YTVmMWEtMWQ3MS00OGE1LWE5YjMtNjc4NWJmYjRmZTQyXkEyXkFqcGdeQXVyNTA4NzY1MzY@._V1_UY98_CR0,0,67,98_AL_.jpg","A group of Serbian socialists prepares for the war in a surreal underground filled by parties, tragedies, love, and hate."
Before Sunrise,"https://m.media-amazon.com/images/M/MV5BZDdiZTAwYzAtMDI3Ni00OTRjLTkzN2UtMGE3MDMyZmU4NTU4XkEyXkFqcGdeQXVyNjU0OTQ0OTY@._V1_UX67_CR0,0,67,98_AL_.jpg","A young man and woman meet on a train in Europe, and wind up spending one evening together in Vienna. Unfortunately, both know that this will probably be their only night together."
In the Name of the Father,"https://m.media-amazon.com/images/M/MV5BMmYyOTgwYWItYmU3Ny00M2E2LTk0NWMtMDVlNmQ0MWZiMTMxXkEyXkFqcGdeQXVyNzkwMjQ5NzM@._V1_UX67_CR0,0,67,98_AL_.jpg",A man's coerced confession to an I.R.A. bombing he did not commit results in the imprisonment of his father as well. An English lawyer fights to free them.
Groundhog Day,"https://m.media-amazon.com/images/M/MV5BZWIxNzM5YzQtY2FmMS00Yjc3LWI1ZjUtNGVjMjMzZTIxZTIxXkEyXkFqcGdeQXVyNjU0OTQ0OTY@._V1_UX67_CR0,0,67,98_AL_.jpg",A self-centered Pittsburgh weatherman finds himself inexplicably trapped in a small town as he lives the same day over and over again.
Aladdin,"https://m.media-amazon.com/images/M/MV5BY2Q2NDI1MjUtM2Q5ZS00MTFlLWJiYWEtNTZmNjQ3OGJkZDgxXkEyXkFqcGdeQXVyNTI4MjkwNjA@._V1_UX67_CR0,0,67,98_AL_.jpg",A kindhearted street urchin and a power-hungry Grand Vizier vie for a magic lamp that has the power to make their deepest wishes come true.
Beauty and the Beast,"https://m.media-amazon.com/images/M/MV5BMzE5MDM1NDktY2I0OC00YWI5LTk2NzUtYjczNDczOWQxYjM0XkEyXkFqcGdeQXVyMTQxNzMzNDI@._V1_UX67_CR0,0,67,98_AL_.jpg",A prince cursed to spend his days as a hideous monster sets out to regain his humanity by earning a young woman's love.
Dances with Wolves,"https://m.media-amazon.com/images/M/MV5BMTY3OTI5NDczN15BMl5BanBnXkFtZTcwNDA0NDY3Mw@@._V1_UX67_CR0,0,67,98_AL_.jpg","Lieutenant John Dunbar, assigned to a remote western Civil War outpost, befriends wolves and Native Americans, making him an intolerable aberration in the military."
Dead Poets Society,"https://m.media-amazon.com/images/M/MV5BOGYwYWNjMzgtNGU4ZC00NWQ2LWEwZjUtMzE1Zjc3NjY3YTU1XkEyXkFqcGdeQXVyMTQxNzMzNDI@._V1_UX67_CR0,0,67,98_AL_.jpg",Maverick teacher John Keating uses poetry to embolden his boarding school students to new heights of self-expression.
Stand by Me,"https://m.media-amazon.com/images/M/MV5BODJmY2Y2OGQtMDg2My00N2Q3LWJmZTUtYTc2ODBjZDVlNDlhXkEyXkFqcGdeQXVyMTQxNzMzNDI@._V1_UX67_CR0,0,67,98_AL_.jpg","After the death of one of his friends, a writer recounts a childhood journey with his friends to find the body of a missing boy."
Platoon,"https://m.media-amazon.com/images/M/MV5BMzRjZjdlMjQtODVkYS00N2YzLWJlYWYtMGVlN2E5MWEwMWQzXkEyXkFqcGdeQXVyMTQxNzMzNDI@._V1_UX67_CR0,0,67,98_AL_.jpg","Chris Taylor, a neophyte recruit in Vietnam, finds himself caught in a battle of wills between two sergeants, one good and the other evil. A shrewd examination of the brutality of war and the duality of man in conflict."
Jean de Florette,"https://m.media-amazon.com/images/M/MV5BYjU4MmY3ZDAtNWIwZC00MDUzLThkYjgtNzNmYThmZTcwMTBjXkEyXkFqcGdeQXVyNTI2ODA2NTc@._V1_UX67_CR0,0,67,98_AL_.jpg",A greedy landowner and his backward nephew conspire to block the only water source for an adjoining property in order to bankrupt the owner and force him to sell.
The Terminator,"https://m.media-amazon.com/images/M/MV5BYTViNzMxZjEtZGEwNy00MDNiLWIzNGQtZDY2MjQ1OWViZjFmXkEyXkFqcGdeQXVyNzkwMjQ5NzM@._V1_UX67_CR0,0,67,98_AL_.jpg","A human soldier is sent from 2029 to 1984 to stop an almost indestructible cyborg killing machine, sent from the same year, which has been programmed to execute a young woman whose unborn son is the key to humanity's future salvation."
"Paris, Texas","https://m.media-amazon.com/images/M/MV5BM2RjMmU3ZWItYzBlMy00ZmJkLWE5YzgtNTVkODdhOWM3NGZhXkEyXkFqcGdeQXVyNDA5Mjg5MjA@._V1_UX67_CR0,0,67,98_AL_.jpg","Travis Henderson, an aimless drifter who has been missing for four years, wanders out of the desert and must reconnect with society, himself, his life, and his family."
Gandhi,"https://m.media-amazon.com/images/M/MV5BMzJiZDRmOWUtYjE2MS00Mjc1LTg1ZDYtNTQxYWJkZTg1OTM4XkEyXkFqcGdeQXVyNjUwNzk3NDc@._V1_UX67_CR0,0,67,98_AL_.jpg",The life of the lawyer who became the famed leader of the Indian revolts against the British rule through his philosophy of nonviolent protest.
Blade Runner,"https://m.media-amazon.com/images/M/MV5BNzQzMzJhZTEtOWM4NS00MTdhLTg0YjgtMjM4MDRkZjUwZDBlXkEyXkFqcGdeQXVyNjU0OTQ0OTY@._V1_UX67_CR0,0,67,98_AL_.jpg","A blade runner must pursue and terminate four replicants who stole a ship in space, and have returned to Earth to find their creator."
Stalker,"https://m.media-amazon.com/images/M/MV5BMDgwODNmMGItMDcwYi00OWZjLTgyZjAtMGYwMmI4N2Q0NmJmXkEyXkFqcGdeQXVyNzY1MTU0Njk@._V1_UY98_CR1,0,67,98_AL_.jpg",A guide leads two men through an area known as the Zone to find a room that grants wishes.
Life of Brian,"https://m.media-amazon.com/images/M/MV5BMzAwNjU1OTktYjY3Mi00NDY5LWFlZWUtZjhjNGE0OTkwZDkwXkEyXkFqcGdeQXVyMTQxNzMzNDI@._V1_UX67_CR0,0,67,98_AL_.jpg","Born on the original Christmas in the stable next door to Jesus Christ, Brian of Nazareth spends his life being mistaken for a messiah."
The Deer Hunter,"https://m.media-amazon.com/images/M/MV5BNDhmNTA0ZDMtYjhkNS00NzEzLWIzYTItOGNkMTVmYjE2YmI3XkEyXkFqcGdeQXVyNzkwMjQ5NzM@._V1_UX67_CR0,0,67,98_AL_.jpg",An in-depth examination of the ways in which the Vietnam War impacts and disrupts the lives of several friends in a small steel mill town in Pennsylvania.
Rocky,"https://m.media-amazon.com/images/M/MV5BMTY5MDMzODUyOF5BMl5BanBnXkFtZTcwMTQ3NTMyNA@@._V1_UX67_CR0,0,67,98_AL_.jpg",A small-time Philadelphia boxer gets a supremely rare chance to fight the world heavyweight champion in a bout in which he strives to go the distance for his self-respect.
Network,"https://m.media-amazon.com/images/M/MV5BZGNjYjM2MzItZGQzZi00NmY3LTgxOGUtMTQ2MWQxNWQ2MmMwXkEyXkFqcGdeQXVyNzM0MTUwNTY@._V1_UX67_CR0,0,67,98_AL_.jpg","A television network cynically exploits a deranged former anchor's ravings and revelations about the news media for its own profit, but finds that his message may be difficult to control."
The Message,"https://m.media-amazon.com/images/M/MV5BMjk3YjJmYTctMTAzZC00MzE4LWFlZGMtNDM5OTMyMDEzZWIxXkEyXkFqcGdeQXVyNTI4MjkwNjA@._V1_UX67_CR0,0,67,98_AL_.jpg",This epic historical drama chronicles the life and times of Prophet Muhammad and serves as an introduction to early Islamic history.
Sholay,"https://m.media-amazon.com/images/M/MV5BOWQ0YTUzYzItYjI0MC00OTZmLWE1MWQtY2EzMzU2MTlmMmJjXkEyXkFqcGdeQXVyMDkwNTkwNg@@._V1_UY98_CR4,0,67,98_AL_.jpg","After his family is murdered by a notorious and ruthless bandit, a former police officer enlists the services of two outlaws to capture the bandit."
Jaws,"https://m.media-amazon.com/images/M/MV5BMmVmODY1MzEtYTMwZC00MzNhLWFkNDMtZjAwM2EwODUxZTA5XkEyXkFqcGdeQXVyNTAyODkwOQ@@._V1_UX67_CR0,0,67,98_AL_.jpg","When a killer shark unleashes chaos on a beach community off Long Island, it's up to a local sheriff, a marine biologist, and an old seafarer to hunt the beast down."
Barry Lyndon,"https://m.media-amazon.com/images/M/MV5BNmY0MWY2NDctZDdmMi00MjA1LTk0ZTQtZDMyZTQ1NTNlYzVjXkEyXkFqcGdeQXVyMjUzOTY1NTc@._V1_UX67_CR0,0,67,98_AL_.jpg",An Irish rogue wins the heart of a rich widow and assumes her dead husband's aristocratic position in 18th-century England.
Paper Moon,"https://m.media-amazon.com/images/M/MV5BOWVmYzQwY2MtOTBjNi00MDNhLWI5OGMtN2RiMDYxODI3MjU5XkEyXkFqcGdeQXVyMjUzOTY1NTc@._V1_UX67_CR0,0,67,98_AL_.jpg","During the Great Depression, a con man finds himself saddled with a young girl who may or may not be his daughter, and the two forge an unlikely partnership."
The Exorcist,"https://m.media-amazon.com/images/M/MV5BYjhmMGMxZDYtMTkyNy00YWVmLTgyYmUtYTU3ZjcwNTBjN2I1XkEyXkFqcGdeQXVyNzkwMjQ5NzM@._V1_UX67_CR0,0,67,98_AL_.jpg","When a 12-year-old girl is possessed by a mysterious entity, her mother seeks the help of two priests to save her."
Anand,"https://m.media-amazon.com/images/M/MV5BNTMzNGFlYmUtMTA0Ny00MzE1LTk1NjAtNjIxYzczZmQxNzk2XkEyXkFqcGdeQXVyNzI1NzMxNzM@._V1_UY98_CR2,0,67,98_AL_.jpg","The story of a terminally ill man who wishes to live life to the fullest before the inevitable occurs, as told by his best friend."
Cool Hand Luke,"https://m.media-amazon.com/images/M/MV5BOWFlNzZhYmYtYTI5YS00MDQyLWIyNTUtNTRjMWUwNTEzNjA0XkEyXkFqcGdeQXVyNjUwNzk3NDc@._V1_UX67_CR0,0,67,98_AL_.jpg","A laid back Southern man is sentenced to two years in a rural prison, but refuses to conform."
Persona,"https://m.media-amazon.com/images/M/MV5BNjdhMGYyNTYtNTg5OC00MzY0LWE4YjctZWI3NDRkMzIyODBiXkEyXkFqcGdeQXVyMjUzOTY1NTc@._V1_UX67_CR0,0,67,98_AL_.jpg",A nurse is put in charge of a mute actress and finds that their personae are melding together.
Andrei Rublev,"https://m.media-amazon.com/images/M/MV5BNjM2MjMwNzUzN15BMl5BanBnXkFtZTgwMjEzMzE5MTE@._V1_UY98_CR2,0,67,98_AL_.jpg","The life, times and afflictions of the fifteenth-century Russian iconographer St. Andrei Rublev."
The Sound of Music,"https://m.media-amazon.com/images/M/MV5BM2Q3YWMzMWItMjY4NS00ZjQ4LWEwYzQtODMwMjU1ZDg4ZjA4XkEyXkFqcGdeQXVyMDI2NDg0NQ@@._V1_UX67_CR0,0,67,98_AL_.jpg",A young novitiate is sent by her convent in 1930s Austria to become a governess to the seven children of a widowed naval officer.
The Man Who Shot Liberty Valance,"https://m.media-amazon.com/images/M/MV5BMGEyNzhkYzktMGMyZS00YzRiLWJlYjktZjJkOTU5ZDY0ZGI4XkEyXkFqcGdeQXVyNjUwNzk3NDc@._V1_UX67_CR0,0,67,98_AL_.jpg",A senator returns to a western town for the funeral of an old friend and tells the story of his origins.
Inherit the Wind,"https://m.media-amazon.com/images/M/MV5BMGQ5ODNkNWYtYTgxZS00YjJkLThhODAtYzUwNGNiYjRmNjdkXkEyXkFqcGdeQXVyMTg2NTc4MzA@._V1_UY98_CR4,0,67,98_AL_.jpg","Based on a real-life case in 1925, two great lawyers argue the case for and against a Tennessee science teacher accused of the crime of teaching evolution."
Ben-Hur,"https://m.media-amazon.com/images/M/MV5BNjgxY2JiZDYtZmMwOC00ZmJjLWJmODUtMTNmNWNmYWI5ODkwL2ltYWdlL2ltYWdlXkEyXkFqcGdeQXVyNjc1NTYyMjg@._V1_UX67_CR0,0,67,98_AL_.jpg","After a Jewish prince is betrayed and sent into slavery by a Roman friend in 1st-century Jerusalem, he regains his freedom and comes back for revenge."
On the Waterfront,"https://m.media-amazon.com/images/M/MV5BY2I0MWFiZDMtNWQyYy00Njk5LTk3MDktZjZjNTNmZmVkYjkxXkEyXkFqcGdeQXVyNjc1NTYyMjg@._V1_UX67_CR0,0,67,98_AL_.jpg","An ex-prize fighter turned New Jersey longshoreman struggles to stand up to his corrupt union bosses, including his older brother, as he starts to connect with the grieving sister of one of the syndicate's victims."
Ace in the Hole,"https://m.media-amazon.com/images/M/MV5BNDUzZjlhZTYtN2E5MS00ODQ3LWI1ZjgtNzdiZmI0NTZiZTljXkEyXkFqcGdeQXVyMjI4MjA5MzA@._V1_UX67_CR0,0,67,98_AL_.jpg","A frustrated former big-city journalist now stuck working for an Albuquerque newspaper exploits a story about a man trapped in a cave to rekindle his career, but the situation quickly escalates into an out-of-control circus."
White Heat,"https://m.media-amazon.com/images/M/MV5BZmI5NTA3MjItYzdhMi00MWMxLTg3OWMtYWQyYjg5MTFmM2U0L2ltYWdlL2ltYWdlXkEyXkFqcGdeQXVyNjc1NTYyMjg@._V1_UX67_CR0,0,67,98_AL_.jpg",A psychopathic criminal with a mother complex makes a daring break from prison and leads his old gang in a chemical plant payroll heist.
The Third Man,"https://m.media-amazon.com/images/M/MV5BYjE2OTdhMWUtOGJlMy00ZDViLWIzZjgtYjZkZGZmMDZjYmEyXkEyXkFqcGdeQXVyNzkwMjQ5NzM@._V1_UX67_CR0,0,67,98_AL_.jpg","Pulp novelist Holly Martins travels to shadowy, postwar Vienna, only to find himself investigating the mysterious death of an old friend, Harry Lime."
The Red Shoes,"https://m.media-amazon.com/images/M/MV5BOWRmNGEwZjUtZjEwNS00OGZmLThhMmEtZTJlMTU5MGQ3ZWUwXkEyXkFqcGdeQXVyNjc1NTYyMjg@._V1_UX67_CR0,0,67,98_AL_.jpg",A young ballet dancer is torn between the man she loves and her pursuit to become a prima ballerina.
The Best Years of Our Lives,"https://m.media-amazon.com/images/M/MV5BY2RmNTRjYzctODI4Ni00MzQyLWEyNTAtNjU0N2JkMTNhNjJkXkEyXkFqcGdeQXVyNjU0OTQ0OTY@._V1_UX67_CR0,0,67,98_AL_.jpg","Three World War II veterans, two of them traumatized or disabled, return home to the American midwest to discover that they and their families have been irreparably changed."
The Shop Around the Corner,"https://m.media-amazon.com/images/M/MV5BNzc1MTcyNTQ5N15BMl5BanBnXkFtZTgwMzgwMDI0MjE@._V1_UX67_CR0,0,67,98_AL_.jpg","Two employees at a gift shop can barely stand each other, without realizing that they are falling in love through the post as each other's anonymous pen pal."
Rebecca,"https://m.media-amazon.com/images/M/MV5BYTcxYWExOTMtMWFmYy00ZjgzLWI0YjktNWEzYzJkZTg0NDdmL2ltYWdlXkEyXkFqcGdeQXVyNjc1NTYyMjg@._V1_UY98_CR0,0,67,98_AL_.jpg",A self-conscious woman juggles adjusting to her new role as an aristocrat's wife and avoiding being intimidated by his first wife's spectral presence.
The Grapes of Wrath,"https://m.media-amazon.com/images/M/MV5BNzJiOGI2MjctYjUyMS00ZjkzLWE2ZmUtOTg4NTZkOTNhZDc1L2ltYWdlXkEyXkFqcGdeQXVyNjc1NTYyMjg@._V1_UX67_CR0,0,67,98_AL_.jpg","An Oklahoma family driven off their farm by the poverty and hopelessness of the Dust Bowl joins the westward migration to California, suffering the misfortunes of the homeless in the Great Depression."
