Movie_Name,Movie_Poster,Movie_Description
Jai Bhim,"https://m.media-amazon.com/images/M/MV5BY2Y5ZWMwZDgtZDQxYy00Mjk0LThhY2YtMmU1MTRmMjVhMjRiXkEyXkFqcGdeQXVyMTI1NDEyNTM5._V1_UY98_CR5,0,67,98_AL_.jpg","When a tribal man is arrested for a case of alleged theft, his wife turns to a human-rights lawyer to help bring justice."
Soorarai Pottru,"https://m.media-amazon.com/images/M/MV5BOGVjYmM0ZWEtNTFjNi00MWZjLTk3OTItMmFjMDAzZWU1ZDVjXkEyXkFqcGdeQXVyMTI2Mzk1ODg0._V1_UX67_CR0,0,67,98_AL_.jpg","Nedumaaran Rajangam ""Maara"" sets out to make the common man fly and in the process takes on the world's most capital intensive industry and several enemies who stand in his way."
The Shawshank Redemption,"https://m.media-amazon.com/images/M/MV5BMDFkYTc0MGEtZmNhMC00ZDIzLWFmNTEtODM1ZmRlYWMwMWFmXkEyXkFqcGdeQXVyMTMxODk2OTU@._V1_UX67_CR0,0,67,98_AL_.jpg","Two imprisoned men bond over a number of years, finding solace and eventual redemption through acts of common decency."
The Godfather,"https://m.media-amazon.com/images/M/MV5BM2MyNjYxNmUtYTAwNi00MTYxLWJmNWYtYzZlODY3ZTk3OTFlXkEyXkFqcGdeQXVyNzkwMjQ5NzM@._V1_UY98_CR1,0,67,98_AL_.jpg",The aging patriarch of an organized crime dynasty in postwar New York City transfers control of his clandestine empire to his reluctant youngest son.
The Dark Knight,"https://m.media-amazon.com/images/M/MV5BMTMxNTMwODM0NF5BMl5BanBnXkFtZTcwODAyMTk2Mw@@._V1_UX67_CR0,0,67,98_AL_.jpg","When the menace known as the Joker wreaks havoc and chaos on the people of Gotham, Batman must accept one of the greatest psychological and physical tests of his ability to fight injustice."
The Lord of the Rings: The Return of the King,"https://m.media-amazon.com/images/M/MV5BNzA5ZDNlZWMtM2NhNS00NDJjLTk4NDItYTRmY2EwMWZlMTY3XkEyXkFqcGdeQXVyNzkwMjQ5NzM@._V1_UX67_CR0,0,67,98_AL_.jpg",Gandalf and Aragorn lead the World of Men against Sauron's army to draw his gaze from Frodo and Sam as they approach Mount Doom with the One Ring.
Schindler's List,"https://m.media-amazon.com/images/M/MV5BNDE4OTMxMTctNmRhYy00NWE2LTg3YzItYTk3M2UwOTU5Njg4XkEyXkFqcGdeQXVyNjU0OTQ0OTY@._V1_UX67_CR0,0,67,98_AL_.jpg","In German-occupied Poland during World War II, industrialist Oskar Schindler gradually becomes concerned for his Jewish workforce after witnessing their persecution by the Nazis."
The Godfather: Part II,"https://m.media-amazon.com/images/M/MV5BMWMwMGQzZTItY2JlNC00OWZiLWIyMDctNDk2ZDQ2YjRjMWQ0XkEyXkFqcGdeQXVyNzkwMjQ5NzM@._V1_UY98_CR1,0,67,98_AL_.jpg","The early life and career of Vito Corleone in 1920s New York City is portrayed, while his son, Michael, expands and tightens his grip on the family crime syndicate."
12 Angry Men,"https://m.media-amazon.com/images/M/MV5BMWU4N2FjNzYtNTVkNC00NzQ0LTg0MjAtYTJlMjFhNGUxZDFmXkEyXkFqcGdeQXVyNjc1NTYyMjg@._V1_UX67_CR0,0,67,98_AL_.jpg",The jury in a New York City murder trial is frustrated by a single member whose skeptical caution forces them to more carefully consider the evidence before jumping to a hasty verdict.
The Lord of the Rings: The Fellowship of the Ring,"https://m.media-amazon.com/images/M/MV5BN2EyZjM3NzUtNWUzMi00MTgxLWI0NTctMzY4M2VlOTdjZWRiXkEyXkFqcGdeQXVyNDUzOTQ5MjY@._V1_UX67_CR0,0,67,98_AL_.jpg",A meek Hobbit from the Shire and eight companions set out on a journey to destroy the powerful One Ring and save Middle-earth from the Dark Lord Sauron.
Pulp Fiction,"https://m.media-amazon.com/images/M/MV5BNGNhMDIzZTUtNTBlZi00MTRlLWFjM2ItYzViMjE3YzI5MjljXkEyXkFqcGdeQXVyNzkwMjQ5NzM@._V1_UY98_CR0,0,67,98_AL_.jpg","The lives of two mob hitmen, a boxer, a gangster and his wife, and a pair of diner bandits intertwine in four tales of violence and redemption."
The Batman,"https://m.media-amazon.com/images/M/MV5BMDdmMTBiNTYtMDIzNi00NGVlLWIzMDYtZTk3MTQ3NGQxZGEwXkEyXkFqcGdeQXVyMzMwOTU5MDk@._V1_UX67_CR0,0,67,98_AL_.jpg","When the Riddler, a sadistic serial killer, begins murdering key political figures in Gotham, Batman is forced to investigate the city's hidden corruption and question his family's involvement."
Inception,"https://m.media-amazon.com/images/M/MV5BMjAxMzY3NjcxNF5BMl5BanBnXkFtZTcwNTI5OTM0Mw@@._V1_UX67_CR0,0,67,98_AL_.jpg","A thief who steals corporate secrets through the use of dream-sharing technology is given the inverse task of planting an idea into the mind of a C.E.O., but his tragic past may doom the project and his team to disaster."
The Lord of the Rings: The Two Towers,"https://m.media-amazon.com/images/M/MV5BZGMxZTdjZmYtMmE2Ni00ZTdkLWI5NTgtNjlmMjBiNzU2MmI5XkEyXkFqcGdeQXVyNjU0OTQ0OTY@._V1_UX67_CR0,0,67,98_AL_.jpg","While Frodo and Sam edge closer to Mordor with the help of the shifty Gollum, the divided fellowship makes a stand against Sauron's new ally, Saruman, and his hordes of Isengard."
Fight Club,"https://m.media-amazon.com/images/M/MV5BNDIzNDU0YzEtYzE5Ni00ZjlkLTk5ZjgtNjM3NWE4YzA3Nzk3XkEyXkFqcGdeQXVyMjUzOTY1NTc@._V1_UX67_CR0,0,67,98_AL_.jpg",An insomniac office worker and a devil-may-care soap maker form an underground fight club that evolves into much more.
Forrest Gump,"https://m.media-amazon.com/images/M/MV5BNWIwODRlZTUtY2U3ZS00Yzg1LWJhNzYtMmZiYmEyNmU1NjMzXkEyXkFqcGdeQXVyMTQxNzMzNDI@._V1_UY98_CR0,0,67,98_AL_.jpg","The presidencies of Kennedy and Johnson, the Vietnam War, the Watergate scandal and other historical events unfold from the perspective of an Alabama man with an IQ of 75, whose only desire is to be reunited with his childhood sweetheart."
"The Good, The Bad & The Ugly","https://m.media-amazon.com/images/M/MV5BNjJlYmNkZGItM2NhYy00MjlmLTk5NmQtNjg1NmM2ODU4OTMwXkEyXkFqcGdeQXVyMjUzOTY1NTc@._V1_UX67_CR0,0,67,98_AL_.jpg",A bounty hunting scam joins two men in an uneasy alliance against a third in a race to find a fortune in gold buried in a remote cemetery.
Spider-Man: No Way Home,"https://m.media-amazon.com/images/M/MV5BZWMyYzFjYTYtNTRjYi00OGExLWE2YzgtOGRmYjAxZTU3NzBiXkEyXkFqcGdeQXVyMzQ0MzA0NTM@._V1_UX67_CR0,0,67,98_AL_.jpg","With Spider-Man's identity now revealed, Peter asks Doctor Strange for help. When a spell goes wrong, dangerous foes from other worlds start to appear, forcing Peter to discover what it truly means to be Spider-Man."
Interstellar,"https://m.media-amazon.com/images/M/MV5BZjdkOTU3MDktN2IxOS00OGEyLWFmMjktY2FiMmZkNWIyODZiXkEyXkFqcGdeQXVyMTMxODk2OTU@._V1_UX67_CR0,0,67,98_AL_.jpg",A team of explorers travel through a wormhole in space in an attempt to ensure humanity's survival.
The Matrix,"https://m.media-amazon.com/images/M/MV5BNzQzOTk3OTAtNDQ0Zi00ZTVkLWI0MTEtMDllZjNkYzNjNTc4L2ltYWdlXkEyXkFqcGdeQXVyNjU0OTQ0OTY@._V1_UX67_CR0,0,67,98_AL_.jpg","When a beautiful stranger leads computer hacker Neo to a forbidding underworld, he discovers the shocking truth--the life he knows is the elaborate deception of an evil cyber-intelligence."
Goodfellas,"https://m.media-amazon.com/images/M/MV5BY2NkZjEzMDgtN2RjYy00YzM1LWI4ZmQtMjIwYjFjNmI3ZGEwXkEyXkFqcGdeQXVyNzkwMjQ5NzM@._V1_UX67_CR0,0,67,98_AL_.jpg","The story of Henry Hill and his life in the mob, covering his relationship with his wife Karen Hill and his mob partners Jimmy Conway and Tommy DeVito in the Italian-American crime syndicate."
The Empire Strikes Back,"https://m.media-amazon.com/images/M/MV5BYmU1NDRjNDgtMzhiMi00NjZmLTg5NGItZDNiZjU5NTU4OTE0XkEyXkFqcGdeQXVyNzkwMjQ5NzM@._V1_UX67_CR0,0,67,98_AL_.jpg","After the Rebels are brutally overpowered by the Empire on the ice planet Hoth, Luke Skywalker begins Jedi training with Yoda, while his friends are pursued across the galaxy by Darth Vader and bounty hunter Boba Fett."
One Flew Over the Cuckoo's Nest,"https://m.media-amazon.com/images/M/MV5BZjA0OWVhOTAtYWQxNi00YzNhLWI4ZjYtNjFjZTEyYjJlNDVlL2ltYWdlL2ltYWdlXkEyXkFqcGdeQXVyMTQxNzMzNDI@._V1_UX67_CR0,0,67,98_AL_.jpg","A criminal pleads insanity and is admitted to a mental institution, where he rebels against the oppressive nurse and rallies up the scared patients."
It's a Wonderful Life,"https://m.media-amazon.com/images/M/MV5BZjc4NDZhZWMtNGEzYS00ZWU2LThlM2ItNTA0YzQ0OTExMTE2XkEyXkFqcGdeQXVyNjUwMzI2NzU@._V1_UY98_CR0,0,67,98_AL_.jpg",An angel is sent from Heaven to help a desperately frustrated businessman by showing him what life would have been like if he had never existed.
96,"https://m.media-amazon.com/images/M/MV5BZTM1MGM3NjgtZjE4Mi00ZTNlLWI3ODAtNTViZjFmMDc3MjlhXkEyXkFqcGdeQXVyOTA3MTM0MTM@._V1_UY98_CR2,0,67,98_AL_.jpg",Two high school sweethearts meet at a reunion after 22 years and reminisce about their past.
The Pianist,"https://m.media-amazon.com/images/M/MV5BOWRiZDIxZjktMTA1NC00MDQ2LWEzMjUtMTliZmY3NjQ3ODJiXkEyXkFqcGdeQXVyNjU0OTQ0OTY@._V1_UY98_CR2,0,67,98_AL_.jpg",A Polish Jewish musician struggles to survive the destruction of the Warsaw ghetto of World War II.
Saving Private Ryan,"https://m.media-amazon.com/images/M/MV5BZjhkMDM4MWItZTVjOC00ZDRhLThmYTAtM2I5NzBmNmNlMzI1XkEyXkFqcGdeQXVyNDYyMDk5MTU@._V1_UX67_CR0,0,67,98_AL_.jpg","Following the Normandy Landings, a group of U.S. soldiers go behind enemy lines to retrieve a paratrooper whose brothers have been killed in action."
The Green Mile,"https://m.media-amazon.com/images/M/MV5BMTUxMzQyNjA5MF5BMl5BanBnXkFtZTYwOTU2NTY3._V1_UX67_CR0,0,67,98_AL_.jpg","The lives of guards on Death Row are affected by one of their charges: a black man accused of child murder and rape, yet who has a mysterious gift."
Terminator 2: Judgment Day,"https://m.media-amazon.com/images/M/MV5BMGU2NzRmZjUtOGUxYS00ZjdjLWEwZWItY2NlM2JhNjkxNTFmXkEyXkFqcGdeQXVyNjU0OTQ0OTY@._V1_UX67_CR0,0,67,98_AL_.jpg","A cyborg, identical to the one who failed to kill Sarah Connor, must now protect her ten-year-old son John from a more advanced and powerful cyborg."
The Silence of the Lambs,"https://m.media-amazon.com/images/M/MV5BNjNhZTk0ZmEtNjJhMi00YzFlLWE1MmEtYzM1M2ZmMGMwMTU4XkEyXkFqcGdeQXVyNjU0OTQ0OTY@._V1_UX67_CR0,0,67,98_AL_.jpg","A young F.B.I. cadet must receive the help of an incarcerated and manipulative cannibal killer to help catch another serial killer, a madman who skins his victims."
Back to the Future,"https://m.media-amazon.com/images/M/MV5BZmU0M2Y1OGUtZjIxNi00ZjBkLTg1MjgtOWIyNThiZWIwYjRiXkEyXkFqcGdeQXVyMTQxNzMzNDI@._V1_UX67_CR0,0,67,98_AL_.jpg","Marty McFly, a 17-year-old high school student, is accidentally sent thirty years into the past in a time-traveling DeLorean invented by his close friend, the eccentric scientist Doc Brown."
Star Wars,"https://m.media-amazon.com/images/M/MV5BNzVlY2MwMjktM2E4OS00Y2Y3LWE3ZjctYzhkZGM3YzA1ZWM2XkEyXkFqcGdeQXVyNzkwMjQ5NzM@._V1_UX67_CR0,0,67,98_AL_.jpg","Luke Skywalker joins forces with a Jedi Knight, a cocky pilot, a Wookiee and two droids to save the galaxy from the Empire's world-destroying battle station, while also attempting to rescue Princess Leia from the mysterious Darth Vader."
K.G.F: Chapter 1,"https://m.media-amazon.com/images/M/MV5BZDNlNzBjMGUtYTA0Yy00OTI2LWJmZjMtODliYmUyYTI0OGFmXkEyXkFqcGdeQXVyODIwMDI1NjM@._V1_UX67_CR0,0,67,98_AL_.jpg","In the 1970s, a gangster goes undercover as a slave to assassinate the owner of a notorious gold mine."
Parasite,"https://m.media-amazon.com/images/M/MV5BYWZjMjk3ZTItODQ2ZC00NTY5LWE0ZDYtZTI3MjcwN2Q5NTVkXkEyXkFqcGdeQXVyODk4OTc3MTY@._V1_UX67_CR0,0,67,98_AL_.jpg",Greed and class discrimination threaten the newly formed symbiotic relationship between the wealthy Park family and the destitute Kim clan.
Avengers: Infinity War,"https://m.media-amazon.com/images/M/MV5BMjMxNjY2MDU1OV5BMl5BanBnXkFtZTgwNzY1MTUwNTM@._V1_UX67_CR0,0,67,98_AL_.jpg",The Avengers and their allies must be willing to sacrifice all in an attempt to defeat the powerful Thanos before his blitz of devastation and ruin puts an end to the universe.
Whiplash,"https://m.media-amazon.com/images/M/MV5BOTA5NDZlZGUtMjAxOS00YTRkLTkwYmMtYWQ0NWEwZDZiNjEzXkEyXkFqcGdeQXVyMTMxODk2OTU@._V1_UX67_CR0,0,67,98_AL_.jpg",A promising young drummer enrolls at a cut-throat music conservatory where his dreams of greatness are mentored by an instructor who will stop at nothing to realize a student's potential.
The Intouchables,"https://m.media-amazon.com/images/M/MV5BMTYxNDA3MDQwNl5BMl5BanBnXkFtZTcwNTU4Mzc1Nw@@._V1_UX67_CR0,0,67,98_AL_.jpg","After he becomes a quadriplegic from a paragliding accident, an aristocrat hires a young man from the projects to be his caregiver."
3 Idiots,"https://m.media-amazon.com/images/M/MV5BNTkyOGVjMGEtNmQzZi00NzFlLTlhOWQtODYyMDc2ZGJmYzFhXkEyXkFqcGdeQXVyNjU0OTQ0OTY@._V1_UY98_CR0,0,67,98_AL_.jpg","Two friends are searching for their long lost companion. They revisit their college days and recall the memories of their friend who inspired them to think differently, even as the rest of the world called them ""idiots""."
The Prestige,"https://m.media-amazon.com/images/M/MV5BMjA4NDI0MTIxNF5BMl5BanBnXkFtZTYwNTM0MzY2._V1_UX67_CR0,0,67,98_AL_.jpg","After a tragic accident, two stage magicians in 1890s London engage in a battle to create the ultimate illusion while sacrificing everything they have to outwit each other."
The Departed,"https://m.media-amazon.com/images/M/MV5BMTI1MTY2OTIxNV5BMl5BanBnXkFtZTYwNjQ4NjY3._V1_UX67_CR0,0,67,98_AL_.jpg",An undercover cop and a mole in the police attempt to identify each other while infiltrating an Irish gang in South Boston.
Memento,"https://m.media-amazon.com/images/M/MV5BZTcyNjk1MjgtOWI3Mi00YzQwLWI5MTktMzY4ZmI2NDAyNzYzXkEyXkFqcGdeQXVyNjU0OTQ0OTY@._V1_UX67_CR0,0,67,98_AL_.jpg",A man with short-term memory loss attempts to track down his wife's murderer.
Gladiator,"https://m.media-amazon.com/images/M/MV5BMDliMmNhNDEtODUyOS00MjNlLTgxODEtN2U3NzIxMGVkZTA1L2ltYWdlXkEyXkFqcGdeQXVyNjU0OTQ0OTY@._V1_UX67_CR0,0,67,98_AL_.jpg",A former Roman General sets out to exact vengeance against the corrupt emperor who murdered his family and sent him into slavery.
American History X,"https://m.media-amazon.com/images/M/MV5BZTJhN2FkYWEtMGI0My00YWM4LWI2MjAtM2UwNjY4MTI2ZTQyXkEyXkFqcGdeQXVyNjc3MjQzNTI@._V1_UX67_CR0,0,67,98_AL_.jpg",A former neo-nazi skinhead tries to prevent his younger brother from going down the same wrong path that he did.
The Usual Suspects,"https://m.media-amazon.com/images/M/MV5BYTViNjMyNmUtNDFkNC00ZDRlLThmMDUtZDU2YWE4NGI2ZjVmXkEyXkFqcGdeQXVyNjU0OTQ0OTY@._V1_UX67_CR0,0,67,98_AL_.jpg","A sole survivor tells of the twisty events leading up to a horrific gun battle on a boat, which began when five criminals met at a seemingly random police lineup."
The Lion King,"https://m.media-amazon.com/images/M/MV5BYTYxNGMyZTYtMjE3MS00MzNjLWFjNmYtMDk3N2FmM2JiM2M1XkEyXkFqcGdeQXVyNjY5NDU4NzI@._V1_UX67_CR0,0,67,98_AL_.jpg","Lion prince Simba and his father are targeted by his bitter uncle, who wants to ascend the throne himself."
Apocalypse Now,"https://m.media-amazon.com/images/M/MV5BMDdhODg0MjYtYzBiOS00ZmI5LWEwZGYtZDEyNDU4MmQyNzFkXkEyXkFqcGdeQXVyNzkwMjQ5NzM@._V1_UX67_CR0,0,67,98_AL_.jpg",A U.S. Army officer serving in Vietnam is tasked with assassinating a renegade Special Forces Colonel who sees himself as a god.
Alien,"https://m.media-amazon.com/images/M/MV5BMmQ2MmU3NzktZjAxOC00ZDZhLTk4YzEtMDMyMzcxY2IwMDAyXkEyXkFqcGdeQXVyNzkwMjQ5NzM@._V1_UX67_CR0,0,67,98_AL_.jpg",The crew of a commercial spacecraft encounter a deadly lifeform after investigating an unknown transmission.
Once Upon a Time in the West,"https://m.media-amazon.com/images/M/MV5BZGI5MjBmYzYtMzJhZi00NGI1LTk3MzItYjBjMzcxM2U3MDdiXkEyXkFqcGdeQXVyNzkwMjQ5NzM@._V1_UX67_CR0,0,67,98_AL_.jpg",A mysterious stranger with a harmonica joins forces with a notorious desperado to protect a beautiful widow from a ruthless assassin working for the railroad.
Psycho,"https://m.media-amazon.com/images/M/MV5BNTQwNDM1YzItNDAxZC00NWY2LTk0M2UtNDIwNWI5OGUyNWUxXkEyXkFqcGdeQXVyNzkwMjQ5NzM@._V1_UX67_CR0,0,67,98_AL_.jpg","A Phoenix secretary embezzles $40,000 from her employer's client, goes on the run, and checks into a remote motel run by a young man under the domination of his mother."
Rear Window,"https://m.media-amazon.com/images/M/MV5BNGUxYWM3M2MtMGM3Mi00ZmRiLWE0NGQtZjE5ODI2OTJhNTU0XkEyXkFqcGdeQXVyMTQxNzMzNDI@._V1_UX67_CR0,0,67,98_AL_.jpg","A wheelchair-bound photographer spies on his neighbors from his Greenwich Village courtyard apartment window, and becomes convinced one of them has committed murder, despite the skepticism of his fashion-model girlfriend."
Casablanca,"https://m.media-amazon.com/images/M/MV5BY2IzZGY2YmEtYzljNS00NTM5LTgwMzUtMzM1NjQ4NGI0OTk0XkEyXkFqcGdeQXVyNDYyMDk5MTU@._V1_UX67_CR0,0,67,98_AL_.jpg",A cynical expatriate American cafe owner struggles to decide whether or not to help his former lover and her fugitive husband escape the Nazis in French Morocco.
Modern Times,"https://m.media-amazon.com/images/M/MV5BYjJiZjMzYzktNjU0NS00OTkxLWEwYzItYzdhYWJjN2QzMTRlL2ltYWdlL2ltYWdlXkEyXkFqcGdeQXVyNjU0OTQ0OTY@._V1_UX67_CR0,0,67,98_AL_.jpg",The Tramp struggles to live in modern industrial society with the help of a young homeless woman.
City Lights,"https://m.media-amazon.com/images/M/MV5BY2I4MmM1N2EtM2YzOS00OWUzLTkzYzctNDc5NDg2N2IyODJmXkEyXkFqcGdeQXVyNzkwMjQ5NzM@._V1_UX67_CR0,0,67,98_AL_.jpg","With the aid of a wealthy erratic tippler, a dewy-eyed tramp who has fallen in love with a sightless flower girl accumulates money to be able to help her medically."
Hamilton,"https://m.media-amazon.com/images/M/MV5BNjViNWRjYWEtZTI0NC00N2E3LTk0NGQtMjY4NTM3OGNkZjY0XkEyXkFqcGdeQXVyMjUxMTY3ODM@._V1_UX67_CR0,0,67,98_AL_.jpg","The real life of one of America's foremost founding fathers and first Secretary of the Treasury, Alexander Hamilton. Captured live on Broadway from the Richard Rodgers Theater with the original Broadway cast."
Uri: The Surgical Strike,"https://m.media-amazon.com/images/M/MV5BMWU4ZjNlNTQtOGE2MS00NDI0LWFlYjMtMmY3ZWVkMjJkNGRmXkEyXkFqcGdeQXVyNjE1OTQ0NjA@._V1_UY98_CR0,0,67,98_AL_.jpg","Indian army special forces execute a covert operation, avenging the killing of fellow army men at their base by a terrorist group."
Joker,"https://m.media-amazon.com/images/M/MV5BNGVjNWI4ZGUtNzE0MS00YTJmLWE0ZDctN2ZiYTk2YmI3NTYyXkEyXkFqcGdeQXVyMTkxNjUyNQ@@._V1_UX67_CR0,0,67,98_AL_.jpg","In Gotham City, mentally troubled comedian Arthur Fleck is disregarded and mistreated by society. He then embarks on a downward spiral of revolution and bloody crime. This path brings him face-to-face with his alter-ego: the Joker."
Spider-Man: Into the Spider-Verse,"https://m.media-amazon.com/images/M/MV5BMjMwNDkxMTgzOF5BMl5BanBnXkFtZTgwNTkwNTQ3NjM@._V1_UX67_CR0,0,67,98_AL_.jpg","Teen Miles Morales becomes the Spider-Man of his universe, and must join with five spider-powered individuals from other dimensions to stop a threat for all realities."
Avengers: Endgame,"https://m.media-amazon.com/images/M/MV5BMTc5MDE2ODcwNV5BMl5BanBnXkFtZTgwMzI2NzQ2NzM@._V1_UX67_CR0,0,67,98_AL_.jpg","After the devastating events of Avengers: Infinity War (2018), the universe is in ruins. With the help of remaining allies, the Avengers assemble once more in order to reverse Thanos' actions and restore balance to the universe."
Coco,"https://m.media-amazon.com/images/M/MV5BYjQ5NjM0Y2YtNjZkNC00ZDhkLWJjMWItN2QyNzFkMDE3ZjAxXkEyXkFqcGdeQXVyODIxMzk5NjA@._V1_UY98_CR1,0,67,98_AL_.jpg","Aspiring musician Miguel, confronted with his family's ancestral ban on music, enters the Land of the Dead to find his great-great-grandfather, a legendary singer."
The Dark Knight Rises,"https://m.media-amazon.com/images/M/MV5BMTk4ODQzNDY3Ml5BMl5BanBnXkFtZTcwODA0NTM4Nw@@._V1_UX67_CR0,0,67,98_AL_.jpg","Eight years after the Joker's reign of anarchy, Batman, with the help of the enigmatic Catwoman, is forced from his exile to save Gotham City from the brutal guerrilla terrorist Bane."
WALL-E,"https://m.media-amazon.com/images/M/MV5BMjExMTg5OTU0NF5BMl5BanBnXkFtZTcwMjMxMzMzMw@@._V1_UX67_CR0,0,67,98_AL_.jpg","In the distant future, a small waste-collecting robot inadvertently embarks on a space journey that will ultimately decide the fate of mankind."
The Lives of Others,"https://m.media-amazon.com/images/M/MV5BOTQyZGFjNWMtYWFiYy00OWU1LTlhMjAtYTBiNmU5NjJiNTAzXkEyXkFqcGdeQXVyMTI3ODAyMzE2._V1_UY98_CR1,0,67,98_AL_.jpg","In 1984 East Berlin, an agent of the secret police, conducting surveillance on a writer and his lover, finds himself becoming increasingly absorbed by their lives."
American Beauty,"https://m.media-amazon.com/images/M/MV5BNTBmZWJkNjctNDhiNC00MGE2LWEwOTctZTk5OGVhMWMyNmVhXkEyXkFqcGdeQXVyMTMxODk2OTU@._V1_UX67_CR0,0,67,98_AL_.jpg",A sexually frustrated suburban father has a mid-life crisis after becoming infatuated with his daughter's best friend.
Braveheart,"https://m.media-amazon.com/images/M/MV5BMzkzMmU0YTYtOWM3My00YzBmLWI0YzctOGYyNTkwMWE5MTJkXkEyXkFqcGdeQXVyNzkwMjQ5NzM@._V1_UX67_CR0,0,67,98_AL_.jpg",Scottish warrior William Wallace leads his countrymen in a rebellion to free his homeland from the tyranny of King Edward I of England.
Aliens,"https://m.media-amazon.com/images/M/MV5BZGU2OGY5ZTYtMWNhYy00NjZiLWI0NjUtZmNhY2JhNDRmODU3XkEyXkFqcGdeQXVyNzkwMjQ5NzM@._V1_UX67_CR0,0,67,98_AL_.jpg","Fifty-seven years after surviving an apocalyptic attack aboard her space vessel by merciless space creatures, Officer Ripley awakens from hyper-sleep and tries to warn anyone who will listen about the predators."
Once Upon a Time in America,"https://m.media-amazon.com/images/M/MV5BMGFkNWI4MTMtNGQ0OC00MWVmLTk3MTktOGYxN2Y2YWVkZWE2XkEyXkFqcGdeQXVyNjU0OTQ0OTY@._V1_UX67_CR0,0,67,98_AL_.jpg","A former Prohibition-era Jewish gangster returns to the Lower East Side of Manhattan 35 years later, where he must once again confront the ghosts and regrets of his old life."
Amadeus,"https://m.media-amazon.com/images/M/MV5BNWJlNzUzNGMtYTAwMS00ZjI2LWFmNWQtODcxNWUxODA5YmU1XkEyXkFqcGdeQXVyNTIzOTk5ODM@._V1_UX67_CR0,0,67,98_AL_.jpg","The life, success and troubles of Wolfgang Amadeus Mozart, as told by Antonio Salieri, the contemporaneous composer who was insanely jealous of Mozart's talent and claimed to have murdered him."
Raiders of the Lost Ark,"https://m.media-amazon.com/images/M/MV5BMjA0ODEzMTc1Nl5BMl5BanBnXkFtZTcwODM2MjAxNA@@._V1_UX67_CR0,0,67,98_AL_.jpg","In 1936, archaeologist and adventurer Indiana Jones is hired by the U.S. government to find the Ark of the Covenant before Adolf Hitler's Nazis can obtain its awesome powers."
Das Boot,"https://m.media-amazon.com/images/M/MV5BOGZhZDIzNWMtNjkxMS00MDQ1LThkMTYtZWQzYWU3MWMxMGU5XkEyXkFqcGdeQXVyNjc1NTYyMjg@._V1_UX67_CR0,0,67,98_AL_.jpg","The claustrophobic world of a WWII German U-boat; boredom, filth and sheer terror."
The Shining,"https://m.media-amazon.com/images/M/MV5BZWFlYmY2MGEtZjVkYS00YzU4LTg0YjQtYzY1ZGE3NTA5NGQxXkEyXkFqcGdeQXVyMTQxNzMzNDI@._V1_UX67_CR0,0,67,98_AL_.jpg","A family heads to an isolated hotel for the winter where a sinister presence influences the father into violence, while his psychic son sees horrific forebodings from both past and future."
Dr. Strangelove or: How I Learned to Stop Worrying and Love the Bomb,"https://m.media-amazon.com/images/M/MV5BZWI3ZTMxNjctMjdlNS00NmUwLWFiM2YtZDUyY2I3N2MxYTE0XkEyXkFqcGdeQXVyNzkwMjQ5NzM@._V1_UX67_CR0,0,67,98_AL_.jpg","An insane American general orders a bombing attack on the Soviet Union, triggering a path to nuclear holocaust that a war room full of politicians and generals frantically tries to stop."
Witness for the Prosecution,"https://m.media-amazon.com/images/M/MV5BNDQwODU5OWYtNDcyNi00MDQ1LThiOGMtZDkwNWJiM2Y3MDg0XkEyXkFqcGdeQXVyMDI2NDg0NQ@@._V1_UX67_CR0,0,67,98_AL_.jpg",A veteran British barrister must defend his client in a murder trial that has surprise after surprise.
Paths of Glory,"https://m.media-amazon.com/images/M/MV5BNjViMmRkOTEtM2ViOS00ODg0LWJhYWEtNTBlOGQxNDczOGY3XkEyXkFqcGdeQXVyMDI2NDg0NQ@@._V1_UY98_CR2,0,67,98_AL_.jpg","After refusing to attack an enemy position, a general accuses the soldiers of cowardice and their commanding officer must defend them."
Pather Panchali,"https://m.media-amazon.com/images/M/MV5BMmFkNDY5OTktNzY3Yy00OTFlLThhNjktOTRhMmZjZmIxYjAxXkEyXkFqcGdeQXVyNTgyNTA4MjM@._V1_UX67_CR0,0,67,98_AL_.jpg","Impoverished priest Harihar Ray, dreaming of a better life for himself and his family, leaves his rural Bengal village in search of work."
Sunset Blvd.,"https://m.media-amazon.com/images/M/MV5BMTU0NTkyNzYwMF5BMl5BanBnXkFtZTgwMDU0NDk5MTI@._V1_UX67_CR0,0,67,98_AL_.jpg",A screenwriter develops a dangerous relationship with a faded film star determined to make a triumphant return.
The Great Dictator,"https://m.media-amazon.com/images/M/MV5BMmExYWJjNTktNGUyZS00ODhmLTkxYzAtNWIzOGEyMGNiMmUwXkEyXkFqcGdeQXVyNjU0OTQ0OTY@._V1_UX67_CR0,0,67,98_AL_.jpg",Dictator Adenoid Hynkel tries to expand his empire while a poor Jewish barber tries to avoid persecution from Hynkel's regime.
1917,"https://m.media-amazon.com/images/M/MV5BOTdmNTFjNDEtNzg0My00ZjkxLTg1ZDAtZTdkMDc2ZmFiNWQ1XkEyXkFqcGdeQXVyNTAzNzgwNTg@._V1_UX67_CR0,0,67,98_AL_.jpg","April 6th, 1917. As an infantry battalion assembles to wage war deep in enemy territory, two soldiers are assigned to race against time and deliver a message that will stop 1,600 men from walking straight into a deadly trap."
Up,"https://m.media-amazon.com/images/M/MV5BMTk3NDE2NzI4NF5BMl5BanBnXkFtZTgwNzE1MzEyMTE@._V1_UX67_CR0,0,67,98_AL_.jpg","78-year-old Carl Fredricksen travels to Paradise Falls in his house equipped with balloons, inadvertently taking a young stowaway."
The Father,"https://m.media-amazon.com/images/M/MV5BZGJhNWRiOWQtMjI4OS00ZjcxLTgwMTAtMzQ2ODkxY2JkOTVlXkEyXkFqcGdeQXVyMTkxNjUyNQ@@._V1_UX67_CR0,0,67,98_AL_.jpg","A man refuses all assistance from his daughter as he ages. As he tries to make sense of his changing circumstances, he begins to doubt his loved ones, his own mind and even the fabric of his reality."
Toy Story 3,"https://m.media-amazon.com/images/M/MV5BMTgxOTY4Mjc0MF5BMl5BanBnXkFtZTcwNTA4MDQyMw@@._V1_UY98_CR1,0,67,98_AL_.jpg","The toys are mistakenly delivered to a day-care center instead of the attic right before Andy leaves for college, and it's up to Woody to convince the other toys that they weren't abandoned and to return home."
