Movie_Name,Movie_Poster,Movie_Description
Sweet Smell of Success,"https://m.media-amazon.com/images/M/MV5BMjE5NTU3YWYtOWIxNi00YWZhLTg2NzktYzVjZWY5MDQ4NzVlXkEyXkFqcGdeQXVyNjc1NTYyMjg@._V1_UX67_CR0,0,67,98_AL_.jpg",Powerful but unethical Broadway columnist J.J. Hunsecker coerces unscrupulous press agent Sidney Falco into breaking up his sister's romance with a jazz musician.
The Killing,"https://m.media-amazon.com/images/M/MV5BMDE5ZjAwY2YtOWM5Yi00ZWNlLWE5ODQtYjA4NzA1NGFkZDU5XkEyXkFqcGdeQXVyNjc1NTYyMjg@._V1_UX67_CR0,0,67,98_AL_.jpg",Crook Johnny Clay assembles a five-man team to plan and execute a daring racetrack robbery.
The Night of the Hunter,"https://m.media-amazon.com/images/M/MV5BYTNjN2M2MzYtZGEwMi00Mzc5LWEwYTMtODM1ZmRiZjFiNTU0L2ltYWdlL2ltYWdlXkEyXkFqcGdeQXVyNjc1NTYyMjg@._V1_UX67_CR0,0,67,98_AL_.jpg","A religious fanatic marries a gullible widow whose young children are reluctant to tell him where their real daddy hid the $10,000 he'd stolen in a robbery."
Stalag 17,"https://m.media-amazon.com/images/M/MV5BNDMyNGU0NjUtNTIxMC00ZmU2LWE0ZGItZTdkNGVlODI2ZDcyL2ltYWdlXkEyXkFqcGdeQXVyNjc1NTYyMjg@._V1_UX67_CR0,0,67,98_AL_.jpg","After two Americans are killed while escaping from a German P.O.W. camp in World War II, the barracks black marketeer, J.J. Sefton, is suspected of being an informer."
Roman Holiday,"https://m.media-amazon.com/images/M/MV5BMTE2MDM4MTMtZmNkZC00Y2QyLWE0YjUtMTAxZGJmODMxMDM0XkEyXkFqcGdeQXVyNjc1NTYyMjg@._V1_UX67_CR0,0,67,98_AL_.jpg",A bored and sheltered princess escapes her guardians and falls in love with an American newsman in Rome.
High Noon,"https://m.media-amazon.com/images/M/MV5BOWIzZGUxZmItOThkMS00Y2QxLTg0MTYtMDdhMjRlNTNlYTI3L2ltYWdlXkEyXkFqcGdeQXVyNjc1NTYyMjg@._V1_UX67_CR0,0,67,98_AL_.jpg","A town Marshal, despite the disagreements of his newlywed bride and the townspeople around him, must face a gang of deadly killers alone at high noon when the gang leader, an outlaw he sent up years ago, arrives on the noon train."
A Streetcar Named Desire,"https://m.media-amazon.com/images/M/MV5BNzk2M2Y3MzYtNGMzMi00Y2FjLTkwODQtNmExYWU3ZWY3NzExXkEyXkFqcGdeQXVyNTA4NzY1MzY@._V1_UX67_CR0,0,67,98_AL_.jpg",Disturbed Blanche DuBois moves in with her sister in New Orleans and is tormented by her brutish brother-in-law while her reality crumbles around her.
Kind Hearts and Coronets,"https://m.media-amazon.com/images/M/MV5BZjc1Yzc0ZmItMzU1OS00OWVlLThmYTctMWNlYmFlMjkxMzc0XkEyXkFqcGdeQXVyNTA1NjYyMDk@._V1_UY98_CR32,0,67,98_AL_.jpg",A distant poor relative of the Duke D'Ascoyne plots to inherit the title by murdering the eight other heirs who stand ahead of him in the line of succession.
Rope,"https://m.media-amazon.com/images/M/MV5BYWFjMDNlYzItY2VlMS00ZTRkLWJjYTEtYjI5NmFlMGE3MzQ2XkEyXkFqcGdeQXVyNjc1NTYyMjg@._V1_UX67_CR0,0,67,98_AL_.jpg",Two men attempt to prove they committed the perfect crime by hosting a dinner party after strangling their former classmate to death.
Out of the Past,"https://m.media-amazon.com/images/M/MV5BMDE0MjYxYmMtM2VhMC00MjhiLTg5NjItMDkzZGM5MGVlYjMxL2ltYWdlL2ltYWdlXkEyXkFqcGdeQXVyNjc1NTYyMjg@._V1_UX67_CR0,0,67,98_AL_.jpg","A private eye escapes his past to run a gas station in a small town, but his past catches up with him. Now he must return to the big city world of danger, corruption, double crosses and duplicitous dames."
Brief Encounter,"https://m.media-amazon.com/images/M/MV5BYWQ0MGNjOTYtMWJlNi00YWMxLWFmMzktYjAyNTVkY2U1NWNhL2ltYWdlL2ltYWdlXkEyXkFqcGdeQXVyNjc1NTYyMjg@._V1_UX67_CR0,0,67,98_AL_.jpg","Meeting a stranger in a railway station, a woman is tempted to cheat on her husband."
The Maltese Falcon,"https://m.media-amazon.com/images/M/MV5BZjIwNGM1ZTUtOThjYS00NDdiLTk2ZDYtNGY5YjJkNzliM2JjL2ltYWdlL2ltYWdlXkEyXkFqcGdeQXVyMDI2NDg0NQ@@._V1_UX67_CR0,0,67,98_AL_.jpg","San Francisco private detective Sam Spade takes on a case that involves him with three eccentric criminals, a gorgeous liar, and their quest for a priceless statuette, with the stakes rising after his partner is murdered."
Knives Out,"https://m.media-amazon.com/images/M/MV5BMGUwZjliMTAtNzAxZi00MWNiLWE2NzgtZGUxMGQxZjhhNDRiXkEyXkFqcGdeQXVyNjU1NzU3MzE@._V1_UX67_CR0,0,67,98_AL_.jpg","A detective investigates the death of the patriarch of an eccentric, combative family."
Marriage Story,"https://m.media-amazon.com/images/M/MV5BZGVmY2RjNDgtMTc3Yy00YmY0LTgwODItYzBjNWJhNTRlYjdkXkEyXkFqcGdeQXVyMjM4NTM5NDY@._V1_UX67_CR0,0,67,98_AL_.jpg",Noah Baumbach's incisive and compassionate look at a marriage breaking up and a family staying together.
Hindi Medium,"https://m.media-amazon.com/images/M/MV5BY2E4NWQ4ZjEtNThlOC00NThjLThmZjgtMWU0MDgzMmYwOGU3XkEyXkFqcGdeQXVyODE5NzE3OTE@._V1_UY98_CR0,0,67,98_AL_.jpg",A couple from Chandni Chowk aspire to give their daughter the best education and thus be a part of and accepted by the elite of Delhi.
Call Me by Your Name,"https://m.media-amazon.com/images/M/MV5BNDk3NTEwNjc0MV5BMl5BanBnXkFtZTgwNzYxNTMwMzI@._V1_UX67_CR0,0,67,98_AL_.jpg","In 1980s Italy, romance blossoms between a seventeen-year-old student and the older man hired as his father's research assistant."
"I, Daniel Blake","https://m.media-amazon.com/images/M/MV5BMTQ4NTMzMTk4NV5BMl5BanBnXkFtZTgwNTU5MjE4MDI@._V1_UX67_CR0,0,67,98_AL_.jpg","After surviving a heart-attack, a 59-year-old carpenter must fight bureaucratic forces to receive Employment and Support Allowance."
Sing Street,"https://m.media-amazon.com/images/M/MV5BMjEzODA3MDcxMl5BMl5BanBnXkFtZTgwODgxNDk3NzE@._V1_UX67_CR0,0,67,98_AL_.jpg",A boy growing up in Dublin during the 1980s escapes his strained family life by starting a band to impress the mysterious girl he likes.
Thor: Ragnarok,"https://m.media-amazon.com/images/M/MV5BMjMyNDkzMzI1OF5BMl5BanBnXkFtZTgwODcxODg5MjI@._V1_UX67_CR0,0,67,98_AL_.jpg","Imprisoned on the planet Sakaar, Thor must race against time to return to Asgard and stop Ragnarok, the destruction of his world, at the hands of the powerful and ruthless villain Hela."
Nightcrawler,"https://m.media-amazon.com/images/M/MV5BN2U1YzdhYWMtZWUzMi00OWI1LWFkM2ItNWVjM2YxMGQ2MmNhXkEyXkFqcGdeQXVyNjU0OTQ0OTY@._V1_UY98_CR0,0,67,98_AL_.jpg","When Louis Bloom, a con man desperate for work, muscles into the world of L.A. crime journalism, he blurs the line between observer and participant to become the star of his own story."
Jojo Rabbit,"https://m.media-amazon.com/images/M/MV5BZjU0Yzk2MzEtMjAzYy00MzY0LTg2YmItM2RkNzdkY2ZhN2JkXkEyXkFqcGdeQXVyNDg4NjY5OTQ@._V1_UX67_CR0,0,67,98_AL_.jpg",A young German boy in the Hitler Youth whose hero and imaginary friend is the country's dictator is shocked to discover that his mother is hiding a Jewish girl in their home.
Wonder,"https://m.media-amazon.com/images/M/MV5BYjFhOWY0OTgtNDkzMC00YWJkLTk1NGEtYWUxNjhmMmQ5ZjYyXkEyXkFqcGdeQXVyMjMxOTE0ODA@._V1_UX67_CR0,0,67,98_AL_.jpg","Based on the New York Times bestseller, this movie tells the incredibly inspiring and heartwarming story of August Pullman, a boy with facial differences who enters the fifth grade, attending a mainstream elementary school for the first time."
Arrival,"https://m.media-amazon.com/images/M/MV5BMTExMzU0ODcxNDheQTJeQWpwZ15BbWU4MDE1OTI4MzAy._V1_UX67_CR0,0,67,98_AL_.jpg",A linguist works with the military to communicate with alien lifeforms after twelve mysterious spacecraft appear around the world.
Star Wars: Episode VII - The Force Awakens,"https://m.media-amazon.com/images/M/MV5BOTAzODEzNDAzMl5BMl5BanBnXkFtZTgwMDU1MTgzNzE@._V1_UX67_CR0,0,67,98_AL_.jpg","As a new threat to the galaxy rises, Rey, a desert scavenger, and Finn, an ex-stormtrooper, must join Han Solo and Chewbacca to search for the one hope of restoring peace."
Gully Boy,"https://m.media-amazon.com/images/M/MV5BZDkzMTQ1YTMtMWY4Ny00MzExLTkzYzEtNzZhOTczNzU2NTU1XkEyXkFqcGdeQXVyODY3NjMyMDU@._V1_UY98_CR4,0,67,98_AL_.jpg",A coming-of-age story based on the lives of street rappers in Mumbai.
Short Term 12,"https://m.media-amazon.com/images/M/MV5BY2Q0YWUwZmYtMDhiNC00OTg5LWJkNDItOGI5MDYxZmQyODRmL2ltYWdlL2ltYWdlXkEyXkFqcGdeQXVyNjIxNDE0OTE@._V1_UY98_CR2,0,67,98_AL_.jpg",A 20-something supervising staff member of a residential treatment facility navigates the troubled waters of that world alongside her co-worker and longtime boyfriend.
Before Midnight,"https://m.media-amazon.com/images/M/MV5BMjA5NzgxODE2NF5BMl5BanBnXkFtZTcwNTI1NTI0OQ@@._V1_UX67_CR0,0,67,98_AL_.jpg",We meet Jesse and Celine nine years on in Greece. Almost two decades have passed since their first meeting on that train bound for Vienna.
English Vinglish,"https://m.media-amazon.com/images/M/MV5BMjQ5YWVmYmYtOWFiZC00NGMxLWEwODctZDM2MWI4YWViN2E5XkEyXkFqcGdeQXVyNjQ2MjQ5NzM@._V1_UY98_CR0,0,67,98_AL_.jpg","A quiet, sweet tempered housewife endures small slights from her well-educated husband and daughter every day because of her inability to speak and understand English."
The Artist,"https://m.media-amazon.com/images/M/MV5BMDUyZWU5N2UtOWFlMy00MTI0LTk0ZDYtMzFhNjljODBhZDA5XkEyXkFqcGdeQXVyNzA4ODc3ODU@._V1_UY98_CR1,0,67,98_AL_.jpg",An egomaniacal film star develops a relationship with a young dancer against the backdrop of Hollywood's silent era.
Edge of Tomorrow,"https://m.media-amazon.com/images/M/MV5BMTc5OTk4MTM3M15BMl5BanBnXkFtZTgwODcxNjg3MDE@._V1_UX67_CR0,0,67,98_AL_.jpg","A soldier fighting aliens gets to relive the same day over and over again, the day restarting every time he dies."
Amour,"https://m.media-amazon.com/images/M/MV5BMTk1NTc3NDc4MF5BMl5BanBnXkFtZTcwNjYwNDk0OA@@._V1_UX67_CR0,0,67,98_AL_.jpg","Georges and Anne are an octogenarian couple. They are cultivated, retired music teachers. Their daughter, also a musician, lives in Britain with her family. One day, Anne has a stroke, and the couple's bond of love is severely tested."
District 9,"https://m.media-amazon.com/images/M/MV5BYmQ5MzFjYWMtMTMwNC00ZGU5LWI3YTQtYzhkMGExNGFlY2Q0XkEyXkFqcGdeQXVyNTIzOTk5ODM@._V1_UX67_CR0,0,67,98_AL_.jpg",Violence ensues after an extraterrestrial race forced to live in slum-like conditions on Earth finds a kindred spirit in a government agent exposed to their biotechnology.
The Wrestler,"https://m.media-amazon.com/images/M/MV5BMTc5MjYyOTg4MF5BMl5BanBnXkFtZTcwNDc2MzQwMg@@._V1_UX67_CR0,0,67,98_AL_.jpg","A faded professional wrestler must retire, but finds his quest for a new life outside the ring a dispiriting struggle."
Jab We Met,"https://m.media-amazon.com/images/M/MV5BYmIzYmY4MGItM2I4YS00OWZhLWFmMzQtYzI2MWY1MmM3NGU1XkEyXkFqcGdeQXVyNjQ2MjQ5NzM@._V1_UY98_CR0,0,67,98_AL_.jpg",A depressed wealthy businessman finds his life changing after he meets a spunky and care-free young woman.
Boyhood,"https://m.media-amazon.com/images/M/MV5BMTYzNDc2MDc0N15BMl5BanBnXkFtZTgwOTcwMDQ5MTE@._V1_UX67_CR0,0,67,98_AL_.jpg","The life of Mason, from early childhood to his arrival at college."
In Bruges,"https://m.media-amazon.com/images/M/MV5BMTUwOGFiM2QtOWMxYS00MjU2LThmZDMtZDM2MWMzNzllNjdhXkEyXkFqcGdeQXVyMTMxODk2OTU@._V1_UX67_CR0,0,67,98_AL_.jpg","Guilt-stricken after a job gone wrong, hitman Ray and his partner await orders from their ruthless boss in Bruges, Belgium, the last place in the world Ray wants to be."
The Man from Earth,"https://m.media-amazon.com/images/M/MV5BMzQ5NGQwOTUtNWJlZi00ZTFiLWI0ZTEtOGU3MTA2ZGU5OWZiXkEyXkFqcGdeQXVyMTczNjQwOTY@._V1_UX67_CR0,0,67,98_AL_.jpg",An impromptu goodbye party for Professor John Oldman becomes a mysterious interrogation after the retiring scholar reveals to his colleagues he has a longer and stranger past than they can imagine.
Avatar,"https://m.media-amazon.com/images/M/MV5BMTYwOTEwNjAzMl5BMl5BanBnXkFtZTcwODc5MTUwMw@@._V1_UX67_CR0,0,67,98_AL_.jpg",A paraplegic Marine dispatched to the moon Pandora on a unique mission becomes torn between following his orders and protecting the world he feels is his home.
Letters from Iwo Jima,"https://m.media-amazon.com/images/M/MV5BMjE0NzgwODI4M15BMl5BanBnXkFtZTcwNjg3OTA0MQ@@._V1_UX67_CR0,0,67,98_AL_.jpg","The story of the battle of Iwo Jima between the United States and Imperial Japan during World War II, as told from the perspective of the Japanese who fought it."
Life of Pi,"https://m.media-amazon.com/images/M/MV5BNTg2OTY2ODg5OF5BMl5BanBnXkFtZTcwODM5MTYxOA@@._V1_UX67_CR0,0,67,98_AL_.jpg","A young man who survives a disaster at sea is hurtled into an epic journey of adventure and discovery. While cast away, he forms an unexpected connection with another survivor: a fearsome Bengal tiger."
Fantastic Mr. Fox,"https://m.media-amazon.com/images/M/MV5BOGUwYTU4NGEtNDM4MS00NDRjLTkwNmQtOTkwMWMyMjhmMjdlXkEyXkFqcGdeQXVyMTMxODk2OTU@._V1_UX67_CR0,0,67,98_AL_.jpg",An urbane fox cannot resist returning to his farm raiding ways and then must help his community survive the farmers' retaliation.
Bin-jip,"https://m.media-amazon.com/images/M/MV5BYzBmODdkMzItNTk0NS00MDc5LWFmZjgtNmNlZmNhMzFlMmQ3XkEyXkFqcGdeQXVyMTI3ODAyMzE2._V1_UY98_CR1,0,67,98_AL_.jpg",A transient young man breaks into empty homes to partake of the vacationing residents' lives for a few days.
C.R.A.Z.Y.,"https://m.media-amazon.com/images/M/MV5BMTU3MDc2MjUwMV5BMl5BanBnXkFtZTcwNzQyMDAzMQ@@._V1_UY98_CR0,0,67,98_AL_.jpg","A young French Canadian, one of five boys in a conservative family in the 1960s and 1970s, struggles to reconcile his emerging identity with his father's values."
Iron Man,"https://m.media-amazon.com/images/M/MV5BMTczNTI2ODUwOF5BMl5BanBnXkFtZTcwMTU0NTIzMw@@._V1_UX67_CR0,0,67,98_AL_.jpg","After being held captive in an Afghan cave, billionaire engineer Tony Stark creates a unique weaponized suit of armor to fight evil."
Shaun of the Dead,"https://m.media-amazon.com/images/M/MV5BMTg5Mjk2NDMtZTk0Ny00YTQ0LWIzYWEtMWI5MGQ0Mjg1OTNkXkEyXkFqcGdeQXVyNzkwMjQ5NzM@._V1_UX67_CR0,0,67,98_AL_.jpg","The uneventful, aimless lives of a London electronics salesman and his layabout roommate are disrupted by the zombie apocalypse."
Mystic River,"https://m.media-amazon.com/images/M/MV5BMTIzNDUyMjA4MV5BMl5BanBnXkFtZTYwNDc4ODM3._V1_UX67_CR0,0,67,98_AL_.jpg",The lives of three men who were childhood friends are shattered when one of them has a family tragedy.
Harry Potter and the Prisoner of Azkaban,"https://m.media-amazon.com/images/M/MV5BMTY4NTIwODg0N15BMl5BanBnXkFtZTcwOTc0MjEzMw@@._V1_UX67_CR0,0,67,98_AL_.jpg","Harry Potter, Ron and Hermione return to Hogwarts School of Witchcraft and Wizardry for their third year of study, where they delve into the mystery surrounding an escaped prisoner who poses a dangerous threat to the young wizard."
No Man's Land,"https://m.media-amazon.com/images/M/MV5BMGFkNjNmZWMtNDdiOS00ZWM3LWE1ZTMtZDU3MGQyMzIyNzZhXkEyXkFqcGdeQXVyMTMxODk2OTU@._V1_UX67_CR0,0,67,98_AL_.jpg","Bosnia and Herzegovina during 1993 at the time of the heaviest fighting between the two warring sides. Two soldiers from opposing sides in the conflict, Nino and Ciki, become trapped in no man's land, whilst a third soldier becomes a living booby trap."
The Bourne Identity,"https://m.media-amazon.com/images/M/MV5BM2JkNGU0ZGMtZjVjNS00NjgyLWEyOWYtZmRmZGQyN2IxZjA2XkEyXkFqcGdeQXVyNTIzOTk5ODM@._V1_UX67_CR0,0,67,98_AL_.jpg","A man is picked up by a fishing boat, bullet-riddled and suffering from amnesia, before racing to elude assassins and attempting to regain his memory."
Children of Men,"https://m.media-amazon.com/images/M/MV5BMTQ5NTI2NTI4NF5BMl5BanBnXkFtZTcwNjk2NDA2OQ@@._V1_UX67_CR0,0,67,98_AL_.jpg","In 2027, in a chaotic world in which women have become somehow infertile, a former activist agrees to help transport a miraculously pregnant woman to a sanctuary at sea."
Almost Famous,"https://m.media-amazon.com/images/M/MV5BMzY1ZjMwMGEtYTY1ZS00ZDllLTk0ZmUtYzA3ZTA4NmYwNGNkXkEyXkFqcGdeQXVyNDk3NzU2MTQ@._V1_UX67_CR0,0,67,98_AL_.jpg",A high-school boy in the early 1970s is given the chance to write a story for Rolling Stone magazine about an up-and-coming rock band as he accompanies them on their concert tour.
Mulholland Dr.,"https://m.media-amazon.com/images/M/MV5BNWM5MWY2ZjItNDY1NC00MzQ3LWFiOGUtYzE2MTI4ZTk1ZTVkXkEyXkFqcGdeQXVyMTYzMDM0NTU@._V1_UY98_CR0,0,67,98_AL_.jpg","After a car wreck on the winding Mulholland Drive renders a woman amnesiac, she and a perky Hollywood-hopeful search for clues and answers across Los Angeles in a twisting venture beyond dreams and reality."
Shrek,"https://m.media-amazon.com/images/M/MV5BOGZhM2FhNTItODAzNi00YjA0LWEyN2UtNjJlYWQzYzU1MDg5L2ltYWdlL2ltYWdlXkEyXkFqcGdeQXVyMTQxNzMzNDI@._V1_UX67_CR0,0,67,98_AL_.jpg","A mean lord exiles fairytale creatures to the swamp of a grumpy ogre, who must go on a quest and rescue a princess for the lord in order to get his land back."
Toy Story 2,"https://m.media-amazon.com/images/M/MV5BMWM5ZDcxMTYtNTEyNS00MDRkLWI3YTItNThmMGExMWY4NDIwXkEyXkFqcGdeQXVyNjUwNzk3NDc@._V1_UX67_CR0,0,67,98_AL_.jpg","When Woody is stolen by a toy collector, Buzz and his friends set out on a rescue mission to save Woody before he becomes a museum toy property with his roundup gang Jessie, Prospector, and Bullseye."
Titanic,"https://m.media-amazon.com/images/M/MV5BMDdmZGU3NDQtY2E5My00ZTliLWIzOTUtMTY4ZGI1YjdiNjk3XkEyXkFqcGdeQXVyNTA4NzY1MzY@._V1_UX67_CR0,0,67,98_AL_.jpg","A seventeen-year-old aristocrat falls in love with a kind but poor artist aboard the luxurious, ill-fated R.M.S. Titanic."
Knockin' on Heaven's Door,"https://m.media-amazon.com/images/M/MV5BMTk2MjcxNjMzN15BMl5BanBnXkFtZTgwMTE3OTEwNjE@._V1_UY98_CR3,0,67,98_AL_.jpg","Two terminally ill patients escape from a hospital, steal a car and rush towards the sea."
Boogie Nights,"https://m.media-amazon.com/images/M/MV5BY2E2YWYxY2QtZmJmZi00MjJlLWFiYWItZTk5Y2IyMWQ1ZThhXkEyXkFqcGdeQXVyMTMxODk2OTU@._V1_UX67_CR0,0,67,98_AL_.jpg","Back when sex was safe, pleasure was a business and business was booming, an idealistic porn producer aspires to elevate his craft to an art when he discovers a hot young talent."
Once Were Warriors,"https://m.media-amazon.com/images/M/MV5BNTQ1MmNmYTUtNmY4ZC00NWQyLWE1YmItZDY4ZmNmMDQyMzAwXkEyXkFqcGdeQXVyMjUzOTY1NTc@._V1_UX67_CR0,0,67,98_AL_.jpg",A family descended from Maori warriors is bedeviled by a violent father and the societal problems of being treated as outcasts.
Ed Wood,"https://m.media-amazon.com/images/M/MV5BNTA5ZjdjNWUtZGUwNy00N2RhLWJiZmItYzFhYjU1NmYxNjY4XkEyXkFqcGdeQXVyMTQxNzMzNDI@._V1_UX67_CR0,0,67,98_AL_.jpg","Ambitious but troubled movie director Edward D. Wood Jr. tries his best to fulfill his dreams, despite his lack of talent."
True Romance,"https://m.media-amazon.com/images/M/MV5BYWRhYWJjNGEtMjNhNi00NzFkLTk1ZGUtNjNmM2FlNTNhNWRjXkEyXkFqcGdeQXVyNzkwMjQ5NzM@._V1_UX67_CR0,0,67,98_AL_.jpg","In Detroit, a lonely pop culture geek marries a call girl, steals cocaine from her pimp, and tries to sell it in Hollywood. Meanwhile, the owners of the cocaine, the Mob, track them down in an attempt to reclaim it."
Carlito's Way,"https://m.media-amazon.com/images/M/MV5BN2I2N2Q1YmMtMzZkMC00Y2JjLWJmOWUtNjc2OTM2ZTk1MjUyXkEyXkFqcGdeQXVyNzkwMjQ5NzM@._V1_UX67_CR0,0,67,98_AL_.jpg","A Puerto Rican former convict, just released from prison, pledges to stay away from drugs and violence despite the pressure around him and lead on to a better life outside of N.Y.C."
Bound by Honor,"https://m.media-amazon.com/images/M/MV5BNzZmMjAxNjQtZjQzOS00NjU4LWI0NDktZjlkZTgwNjVmNzU3XkEyXkFqcGdeQXVyNTI4MjkwNjA@._V1_UX67_CR0,0,67,98_AL_.jpg","Based on the true life experiences of poet Jimmy Santiago Baca, the film focuses on step-brothers Paco and Cruz, and their bi-racial cousin Miklo."
Edward Scissorhands,"https://m.media-amazon.com/images/M/MV5BMWY2MGRkNjgtZDczNi00YWJjLTkwNmUtMTY0NTE5ZDhkZjgwXkEyXkFqcGdeQXVyMjUzOTY1NTc@._V1_UX67_CR0,0,67,98_AL_.jpg","An artificial man, who was incompletely constructed and has scissors for hands, leads a solitary life. Then one day, a suburban lady meets him and introduces him to her world."
My Left Foot: The Story of Christy Brown,"https://m.media-amazon.com/images/M/MV5BYjdkNzA4MzYtZThhOS00ZDgzLTlmMDItNmY1ZjI5YjkzZTE1XkEyXkFqcGdeQXVyMTQxNzMzNDI@._V1_UX67_CR0,0,67,98_AL_.jpg","Christy Brown, born with cerebral palsy, learns to paint and write with his only controllable limb - his left foot."
Do the Right Thing,"https://m.media-amazon.com/images/M/MV5BODA2MjU1NTI1MV5BMl5BanBnXkFtZTgwOTU4ODIwMjE@._V1_UX67_CR0,0,67,98_AL_.jpg","On the hottest day of the year on a street in the Bedford-Stuyvesant section of Brooklyn, everyone's hate and bigotry smolders and builds until it explodes into violence."
Crimes and Misdemeanors,"https://m.media-amazon.com/images/M/MV5BYWY3N2EyOWYtNDVhZi00MWRkLTg2OTUtODNkNDQ5ZTIwMGJkXkEyXkFqcGdeQXVyMTMxODk2OTU@._V1_UX67_CR0,0,67,98_AL_.jpg",An ophthalmologist's mistress threatens to reveal their affair to his wife while a married documentary filmmaker is infatuated with another woman.
Back to the Future Part II,"https://m.media-amazon.com/images/M/MV5BZTMxMGM5MjItNDJhNy00MWI2LWJlZWMtOWFhMjI5ZTQwMWM3XkEyXkFqcGdeQXVyMTQxNzMzNDI@._V1_UX67_CR0,0,67,98_AL_.jpg","After visiting 2015, Marty McFly must repeat his visit to 1955 to prevent disastrous changes to 1985...without interfering with his first trip."
The Untouchables,"https://m.media-amazon.com/images/M/MV5BYTVjYWJmMWQtYWU4Ni00MWY3LWI2YmMtNTI5MDE0MWVmMmEzL2ltYWdlXkEyXkFqcGdeQXVyMTQxNzMzNDI@._V1_UX67_CR0,0,67,98_AL_.jpg","During the era of Prohibition in the United States, Federal Agent Eliot Ness sets out to stop ruthless Chicago gangster Al Capone and, because of rampant corruption, assembles a small, hand-picked team to help him."
Sacrifice,"https://m.media-amazon.com/images/M/MV5BNTczNDE2YTItNjkwMC00YTNhLTkwMjAtOTIxYmIyZmI1MWUyXkEyXkFqcGdeQXVyMjgyNjk3MzE@._V1_UX67_CR0,0,67,98_AL_.jpg","At the dawn of World War III, a man searches for a way to restore peace to the world and finds he must give something in return."
Hannah and Her Sisters,"https://m.media-amazon.com/images/M/MV5BMWZiNWUwYjMtM2Y1Yi00MTZmLWEwYzctNjVmYWM0OTFlZDFhXkEyXkFqcGdeQXVyMTMxODk2OTU@._V1_UX67_CR0,0,67,98_AL_.jpg","Between two Thanksgivings two years apart, Hannah's husband falls in love with her sister Lee, while her hypochondriac ex-husband rekindles his relationship with her sister Holly."
Brazil,"https://m.media-amazon.com/images/M/MV5BMDM0YTM3Y2UtNzY5MC00OTc4LThhZTYtMmM0ZGZjMmU1ZjdmXkEyXkFqcGdeQXVyNjc1NTYyMjg@._V1_UY98_CR0,0,67,98_AL_.jpg",A bureaucrat in a dystopic society becomes an enemy of the state as he pursues the woman of his dreams.
This Is Spinal Tap,"https://m.media-amazon.com/images/M/MV5BMTQ2MTIzMzg5Nl5BMl5BanBnXkFtZTgwOTc5NDI1MDE@._V1_UX67_CR0,0,67,98_AL_.jpg","Spinal Tap, one of England's loudest bands, is chronicled by film director Marty DiBergi on what proves to be a fateful tour."
E.T. the Extra-Terrestrial,"https://m.media-amazon.com/images/M/MV5BMTQ2ODFlMDAtNzdhOC00ZDYzLWE3YTMtNDU4ZGFmZmJmYTczXkEyXkFqcGdeQXVyMTQxNzMzNDI@._V1_UX67_CR0,0,67,98_AL_.jpg",A troubled child summons the courage to help a friendly alien escape Earth and return to his home world.
The Blues Brothers,"https://m.media-amazon.com/images/M/MV5BYTdlMDExOGUtN2I3MS00MjY5LWE1NTAtYzc3MzIxN2M3OWY1XkEyXkFqcGdeQXVyNzkwMjQ5NzM@._V1_UX67_CR0,0,67,98_AL_.jpg","Jake Blues rejoins with his brother Elwood after being released from prison, but the duo has just days to reunite their old R&B band and save the Catholic home where the two were raised, outrunning the police as they tear through Chicago."
Manhattan,"https://m.media-amazon.com/images/M/MV5BZWMzNjg2NDktYzRjZS00MTc4LWE2ZDEtNjk5NTk2MDljZTlhXkEyXkFqcGdeQXVyMjUzOTY1NTc@._V1_UX67_CR0,0,67,98_AL_.jpg",The life of a divorced television writer dating a teenage girl is further complicated when he falls in love with his best friend's mistress.
Dawn of the Dead,"https://m.media-amazon.com/images/M/MV5BMzc1YTIyNjctYzhlNy00ZmYzLWI2ZWQtMzk4MmQwYzA0NGQ1XkEyXkFqcGdeQXVyMTQxNzMzNDI@._V1_UX67_CR0,0,67,98_AL_.jpg","Following an ever-growing epidemic of zombies that have risen from the dead, two Philadelphia S.W.A.T. team members, a traffic reporter, and his television executive girlfriend seek refuge in a secluded shopping mall."
All the President's Men,"https://m.media-amazon.com/images/M/MV5BOWI2YWQxM2MtY2U4Yi00YjgzLTgwNzktN2ExNTgzNTIzMmUzXkEyXkFqcGdeQXVyMTAwMzUyOTc@._V1_UX67_CR0,0,67,98_AL_.jpg","""The Washington Post"" reporters Bob Woodward and Carl Bernstein uncover the details of the Watergate scandal that leads to President Richard Nixon's resignation."
Amarcord,"https://m.media-amazon.com/images/M/MV5BZTlmZjEyNzEtMWEyYS00MTIzLTlmZTQtODNiNWMxMDY4MTViXkEyXkFqcGdeQXVyNDE5MTU2MDE@._V1_UY98_CR0,0,67,98_AL_.jpg",A series of comedic and nostalgic vignettes set in a 1930s Italian coastal town.
Harold and Maude,"https://m.media-amazon.com/images/M/MV5BY2M5Mzg3NjctZTlkNy00MTU0LWFlYTQtY2E2Y2M4NjNiNzllXkEyXkFqcGdeQXVyMTAwMzUyOTc@._V1_UX67_CR0,0,67,98_AL_.jpg","Young, rich, and obsessed with death, Harold finds himself changed forever when he meets lively septuagenarian Maude at a funeral."
The Wild Bunch,"https://m.media-amazon.com/images/M/MV5BNGUyYTZmOWItMDJhMi00N2IxLWIyNDMtNjUxM2ZiYmU5YWU1XkEyXkFqcGdeQXVyNjc1NTYyMjg@._V1_UX67_CR0,0,67,98_AL_.jpg","An aging group of outlaws look for one last big score as the ""traditional"" American West is disappearing around them."
The Lion in Winter,"https://m.media-amazon.com/images/M/MV5BMTkzNzYyMzA5N15BMl5BanBnXkFtZTgwODcwODQ3MDI@._V1_UX67_CR0,0,67,98_AL_.jpg","1183 A.D.: King Henry II's three sons all want to inherit the throne, but he won't commit to a choice. When he allows his imprisoned wife Eleanor of Aquitaine out for a Christmas visit, they all variously plot to force him into a decision."
In Cold Blood,"https://m.media-amazon.com/images/M/MV5BOTg4OGY2NmEtZTZlMy00ZjM3LWIyZjAtMzQzMjI1MmI1OTRhL2ltYWdlL2ltYWdlXkEyXkFqcGdeQXVyNjc1NTYyMjg@._V1_UX67_CR0,0,67,98_AL_.jpg","Two ex-cons murder a family in a robbery attempt, before going on the run from the authorities. The police try to piece together the details of the murder in an attempt to track down the killers."
