Movie_Name,Movie_Poster,Movie_Description
Midnight in Paris,"https://m.media-amazon.com/images/M/MV5BMTM4NjY1MDQwMl5BMl5BanBnXkFtZTcwNTI3Njg3NA@@._V1_UX67_CR0,0,67,98_AL_.jpg","While on a trip to Paris with his fiancée's family, a nostalgic screenwriter finds himself mysteriously going back to the 1920s every day at midnight."
Kokuhaku,"https://m.media-amazon.com/images/M/MV5BOGFmODE2YzktMThjNi00MzhjLWI5M2MtYjdhOTc0NDBhMTZkXkEyXkFqcGdeQXVyMTQxNzMzNDI@._V1_UY98_CR1,0,67,98_AL_.jpg",A psychological thriller of a grieving mother turned cold-blooded avenger with a twisty master plan to pay back those who were responsible for her daughter's death.
Ajeossi,"https://m.media-amazon.com/images/M/MV5BMTgzMTkxNjAxNV5BMl5BanBnXkFtZTgwMDU3MDE0MjE@._V1_UY98_CR0,0,67,98_AL_.jpg",A quiet pawnshop keeper with a violent past takes on a drug-and-organ trafficking ring in hope of saving the child who is his only friend.
The Lego Movie,"https://m.media-amazon.com/images/M/MV5BMTg4MDk1ODExN15BMl5BanBnXkFtZTgwNzIyNjg3MDE@._V1_UX67_CR0,0,67,98_AL_.jpg","An ordinary LEGO construction worker, thought to be the prophesied as ""special"", is recruited to join a quest to stop an evil tyrant from gluing the LEGO universe into eternal stasis."
Gravity,"https://m.media-amazon.com/images/M/MV5BNjE5MzYwMzYxMF5BMl5BanBnXkFtZTcwOTk4MTk0OQ@@._V1_UX67_CR0,0,67,98_AL_.jpg",Two astronauts work together to survive after an accident leaves them stranded in space.
Star Trek Into Darkness,"https://m.media-amazon.com/images/M/MV5BMTk2NzczOTgxNF5BMl5BanBnXkFtZTcwODQ5ODczOQ@@._V1_UX67_CR0,0,67,98_AL_.jpg","After the crew of the Enterprise find an unstoppable force of terror from within their own organization, Captain Kirk leads a manhunt to a war-zone world to capture a one-man weapon of mass destruction."
Beasts of No Nation,"https://m.media-amazon.com/images/M/MV5BMTYwMzMzMDI0NF5BMl5BanBnXkFtZTgwNDQ3NjI3NjE@._V1_UX67_CR0,0,67,98_AL_.jpg","A drama based on the experiences of Agu, a child soldier fighting in the civil war of an unnamed African country."
X: First Class,"https://m.media-amazon.com/images/M/MV5BMTg5OTMxNzk4Nl5BMl5BanBnXkFtZTcwOTk1MjAwNQ@@._V1_UX67_CR0,0,67,98_AL_.jpg","In the 1960s, superpowered humans Charles Xavier and Erik Lensherr work together to find others like them, but Erik's vengeful pursuit of an ambitious mutant who ruined his life causes a schism to divide them."
The Hangover,"https://m.media-amazon.com/images/M/MV5BNGQwZjg5YmYtY2VkNC00NzliLTljYTctNzI5NmU3MjE2ODQzXkEyXkFqcGdeQXVyNzkwMjQ5NzM@._V1_UX67_CR0,0,67,98_AL_.jpg","Three buddies wake up from a bachelor party in Las Vegas, with no memory of the previous night and the bachelor missing. They make their way around the city in order to find their friend before his wedding."
Silver Linings Playbook,"https://m.media-amazon.com/images/M/MV5BMTM2MTI5NzA3MF5BMl5BanBnXkFtZTcwODExNTc0OA@@._V1_UX67_CR0,0,67,98_AL_.jpg","After a stint in a mental institution, former teacher Pat Solitano moves back in with his parents and tries to reconcile with his ex-wife. Things get more challenging when Pat meets Tiffany, a mysterious girl with problems of her own."
Druk,"https://m.media-amazon.com/images/M/MV5BOTNjM2Y2ZjgtMDc5NS00MDQ1LTgyNGYtYzYwMTAyNWQwYTMyXkEyXkFqcGdeQXVyMjE4NzUxNDA@._V1_UX67_CR0,0,67,98_AL_.jpg",Four high school teachers consume alcohol on a daily basis to see how it affects their social and professional lives.
Argo,"https://m.media-amazon.com/images/M/MV5BNzljNjY3MDYtYzc0Ni00YjU0LWIyNDUtNTE0ZDRiMGExMjZlXkEyXkFqcGdeQXVyMTMxODk2OTU@._V1_UX67_CR0,0,67,98_AL_.jpg","Acting under the cover of a Hollywood producer scouting a location for a science fiction film, a CIA agent launches a dangerous operation to rescue six Americans in Tehran during the U.S. hostage crisis in Iran in 1979."
(500) Days of Summer,"https://m.media-amazon.com/images/M/MV5BMTk5MjM4OTU1OV5BMl5BanBnXkFtZTcwODkzNDIzMw@@._V1_UX67_CR0,0,67,98_AL_.jpg","After being dumped by the girl he believes to be his soulmate, hopeless romantic Tom Hansen reflects on their relationship to try and figure out where things went wrong and how he can win her back."
Harry Potter and the Deathly Hallows: Part 1,"https://m.media-amazon.com/images/M/MV5BMTQ2OTE1Mjk0N15BMl5BanBnXkFtZTcwODE3MDAwNA@@._V1_UX67_CR0,0,67,98_AL_.jpg","As Harry, Ron, and Hermione race against time and evil to destroy the Horcruxes, they uncover the existence of the three most powerful objects in the wizarding world: the Deathly Hallows."
Frost/Nixon,"https://m.media-amazon.com/images/M/MV5BMTRiN2RkY2YtMzlkNi00YTMwLThlNmEtNmNhYWVjZjBiZWFkXkEyXkFqcGdeQXVyMjgyNjk3MzE@._V1_UY98_CR1,0,67,98_AL_.jpg",A dramatic retelling of the post-Watergate television interviews between British talk-show host David Frost and former president Richard Nixon.
Papurika,"https://m.media-amazon.com/images/M/MV5BNDI4MGEwZDAtZDg0Yy00MjFhLTg1MjctODdmZTMyNTUyNDI3L2ltYWdlXkEyXkFqcGdeQXVyNTAyODkwOQ@@._V1_UX67_CR0,0,67,98_AL_.jpg","When a machine that allows therapists to enter their patients' dreams is stolen, all hell breaks loose. Only a young female therapist, Paprika, can stop it."
Flipped,"https://m.media-amazon.com/images/M/MV5BMTU2NjQ1Nzc4MF5BMl5BanBnXkFtZTcwNTM0NDk1Mw@@._V1_UX67_CR0,0,67,98_AL_.jpg",Two eighth-graders start to have feelings for each other despite being total opposites.
This Is England,"https://m.media-amazon.com/images/M/MV5BMmE3OWZhZDYtOTBjMi00NDIwLTg1NWMtMjg0NjJmZWM4MjliL2ltYWdlXkEyXkFqcGdeQXVyNTAyODkwOQ@@._V1_UX67_CR0,0,67,98_AL_.jpg","A young boy becomes friends with a gang of skinheads. Friends soon become like family, and relationships will be pushed to the very limit."
Ex Machina,"https://m.media-amazon.com/images/M/MV5BMTUxNzc0OTIxMV5BMl5BanBnXkFtZTgwNDI3NzU2NDE@._V1_UX67_CR0,0,67,98_AL_.jpg",A young programmer is selected to participate in a ground-breaking experiment in synthetic intelligence by evaluating the human qualities of a highly advanced humanoid A.I.
The Last King of Scotland,"https://m.media-amazon.com/images/M/MV5BMjM1NTkxNjkzMl5BMl5BanBnXkFtZTgwNDgwMDAxMzE@._V1_UY98_CR1,0,67,98_AL_.jpg",Based on the events of the brutal Ugandan dictator Idi Amin's regime as seen by his personal physician during the 1970s.
Zodiac,"https://m.media-amazon.com/images/M/MV5BN2UwNDc5NmEtNjVjZS00OTI5LWE5YjctMWM3ZjBiZGYwMGI2XkEyXkFqcGdeQXVyNzkwMjQ5NzM@._V1_UX67_CR0,0,67,98_AL_.jpg","Between 1968 and 1983, a San Francisco cartoonist becomes an amateur detective obsessed with tracking down the Zodiac Killer, an unidentified individual who terrorizes Northern California with a killing spree."
Lucky Number Slevin,"https://m.media-amazon.com/images/M/MV5BZjczMWI1YWMtYTZjOS00ZDc5LWE2MWItMTY3ZGUxNzFkNjJmL2ltYWdlXkEyXkFqcGdeQXVyNjU0OTQ0OTY@._V1_UX67_CR0,0,67,98_AL_.jpg","A case of mistaken identity lands Slevin into the middle of a war being plotted by two of the city's most rival crime bosses. Under constant surveillance by Detective Brikowski and assassin Goodkat, he must get them before they get him."
Control,"https://m.media-amazon.com/images/M/MV5BNTEzOTYwMTcxN15BMl5BanBnXkFtZTcwNTgyNjI1MQ@@._V1_UX67_CR0,0,67,98_AL_.jpg","A profile of Ian Curtis, the enigmatic singer of Joy Division whose personal, professional, and romantic troubles led him to commit suicide at the age of 23."
Watchmen,"https://m.media-amazon.com/images/M/MV5BY2IzNGNiODgtOWYzOS00OTI0LTgxZTUtOTA5OTQ5YmI3NGUzXkEyXkFqcGdeQXVyNjU0OTQ0OTY@._V1_UX67_CR0,0,67,98_AL_.jpg","In 1985 where former superheroes exist, the murder of a colleague sends active vigilante Rorschach into his own sprawling investigation, uncovering something that could completely change the course of history as we know it."
Zwartboek,"https://m.media-amazon.com/images/M/MV5BMTIzMjc2ODQ2NV5BMl5BanBnXkFtZTYwODkzNTA3._V1_UX67_CR0,0,67,98_AL_.jpg","In the Nazi-occupied Netherlands during World War II, a Jewish singer infiltrates the regional Gestapo headquarters for the Dutch resistance."
Brokeback Mountain,"https://m.media-amazon.com/images/M/MV5BMTY5NTAzNTc1NF5BMl5BanBnXkFtZTYwNDY4MDc3._V1_UX67_CR0,0,67,98_AL_.jpg",Ennis and Jack are two shepherds who develop a sexual and emotional relationship. Their relationship becomes complicated when both of them get married to their respective girlfriends.
Vera Drake,"https://m.media-amazon.com/images/M/MV5BZTk1ZmNhNjEtMDZjZi00MTY1LTgwMmYtZDRiNmI4ZDRiNzQ5XkEyXkFqcGdeQXVyMTAwMzUyOTc@._V1_UX67_CR0,0,67,98_AL_.jpg",Abortionist Vera Drake finds her beliefs and practices clash with the mores of 1950s Britain--a conflict that leads to tragedy for her family.
3:10 to Yuma,"https://m.media-amazon.com/images/M/MV5BODE0NTcxNTQzNF5BMl5BanBnXkFtZTcwMzczOTIzMw@@._V1_UX67_CR0,0,67,98_AL_.jpg",A small-time rancher agrees to hold a captured outlaw who's awaiting a train to go to court in Yuma. A battle of wills ensues as the outlaw tries to psych out the rancher.
Kung fu,"https://m.media-amazon.com/images/M/MV5BMjZiOTNlMzYtZWYwZS00YWJjLTk5NDgtODkwNjRhMDI0MjhjXkEyXkFqcGdeQXVyMjgyNjk3MzE@._V1_UY98_CR1,0,67,98_AL_.jpg","In Shanghai, China in the 1940s, a wannabe gangster aspires to join the notorious ""Axe Gang"" while residents of a housing complex exhibit extraordinary powers in defending their turf."
The Bourne Supremacy,"https://m.media-amazon.com/images/M/MV5BYTIyMDFmMmItMWQzYy00MjBiLTg2M2UtM2JiNDRhOWE4NjBhXkEyXkFqcGdeQXVyNjU0OTQ0OTY@._V1_UX67_CR0,0,67,98_AL_.jpg","When Jason Bourne is framed for a CIA operation gone awry, he is forced to resume his former life as a trained assassin to survive."
The Machinist,"https://m.media-amazon.com/images/M/MV5BNjk1NzBlY2YtNjJmNi00YTVmLWI2OTgtNDUxNDE5NjUzZmE0XkEyXkFqcGdeQXVyNTc1NTQxODI@._V1_UX67_CR0,0,67,98_AL_.jpg",An industrial worker who hasn't slept in a year begins to doubt his own sanity.
Ray,"https://m.media-amazon.com/images/M/MV5BMTQxNDQwNjQzOV5BMl5BanBnXkFtZTcwNTQxNDYyMQ@@._V1_UX67_CR0,0,67,98_AL_.jpg","The story of the life and career of the legendary rhythm and blues musician Ray Charles, from his humble beginnings in the South, where he went blind at age seven, to his meteoric rise to stardom during the 1950s and 1960s."
Lost in Translation,"https://m.media-amazon.com/images/M/MV5BMTUxMzk0NDg1MV5BMl5BanBnXkFtZTgwNDg0NjkxMDI@._V1_UX67_CR0,0,67,98_AL_.jpg",A faded movie star and a neglected young woman form an unlikely bond after crossing paths in Tokyo.
Harry Potter and the Goblet of Fire,"https://m.media-amazon.com/images/M/MV5BMTI1NDMyMjExOF5BMl5BanBnXkFtZTcwOTc4MjQzMQ@@._V1_UX67_CR0,0,67,98_AL_.jpg","Harry Potter finds himself competing in a hazardous tournament between rival schools of magic, but he is distracted by recurring nightmares."
Man on Fire,"https://m.media-amazon.com/images/M/MV5BODFlMmEwMDgtYjhmZi00ZTE5LTk2NWQtMWE1Y2M0NjkzOGYxXkEyXkFqcGdeQXVyNjU0OTQ0OTY@._V1_UX67_CR0,0,67,98_AL_.jpg","In Mexico City, a former CIA operative swears vengeance on those who committed an unspeakable act against the family he was hired to protect."
Coraline,"https://m.media-amazon.com/images/M/MV5BMzQxNjM5NzkxNV5BMl5BanBnXkFtZTcwMzg5NDMwMg@@._V1_UX67_CR0,0,67,98_AL_.jpg","An adventurous 11-year-old girl finds another world that is a strangely idealized version of her frustrating home, but it has sinister secrets."
The Magdalene Sisters,"https://m.media-amazon.com/images/M/MV5BMWExODI2ZjUtMTE2MS00NmRkLWJhYzYtYTkyMTFiMzEwMjkzXkEyXkFqcGdeQXVyNjc3MjQzNTI@._V1_UX67_CR0,0,67,98_AL_.jpg",Three young Irish women struggle to maintain their spirits while they endure dehumanizing abuse as inmates of a Magdalene Sisters Asylum.
21 Grams,"https://m.media-amazon.com/images/M/MV5BMjA4MjI2OTM5N15BMl5BanBnXkFtZTcwNDA1NjUzMw@@._V1_UX67_CR0,0,67,98_AL_.jpg","A freak accident brings together a critically ill mathematician, a grieving mother, and a born-again ex-con."
Finding Neverland,"https://m.media-amazon.com/images/M/MV5BYWYwMjFjM2UtMDBiYy00ZjFjLTkwMDYtYThlNWMxNDk3MzdkXkEyXkFqcGdeQXVyNjc3MjQzNTI@._V1_UX67_CR0,0,67,98_AL_.jpg",The story of Sir J.M. Barrie's friendship with a family who inspired him to create Peter Pan.
Good Bye Lenin!,"https://m.media-amazon.com/images/M/MV5BMTI0MTg4NzI3M15BMl5BanBnXkFtZTcwOTE0MTUyMQ@@._V1_UY98_CR0,0,67,98_AL_.jpg","In 1990, to protect his fragile mother from a fatal shock after a long coma, a young man must keep her from learning that her beloved nation of East Germany as she knew it has disappeared."
In America,"https://m.media-amazon.com/images/M/MV5BOGY1YmUzN2MtNDQ3NC00Nzc4LWI5M2EtYzUwMGQ4NWM4NjE1XkEyXkFqcGdeQXVyMTQxNzMzNDI@._V1_UY98_CR0,0,67,98_AL_.jpg",A family of Irish immigrants adjust to life on the mean streets of Hell's Kitchen while also grieving the death of a child.
The Butterfly Effect,"https://m.media-amazon.com/images/M/MV5BODNiZmY2MWUtMjFhMy00ZmM2LTg2MjYtNWY1OTY5NGU2MjdjL2ltYWdlXkEyXkFqcGdeQXVyNTAyODkwOQ@@._V1_UY98_CR0,0,67,98_AL_.jpg","Evan Treborn suffers blackouts during significant events of his life. As he grows up, he finds a way to remember these lost memories and a supernatural way to alter his life by reading his journal."
Adaptation.,"https://m.media-amazon.com/images/M/MV5BZjIwZWU0ZDItNzBlNS00MDIwLWFlZjctZTJjODdjZWYxNzczL2ltYWdlXkEyXkFqcGdeQXVyMTMxODk2OTU@._V1_UX67_CR0,0,67,98_AL_.jpg",A lovelorn screenwriter becomes desperate as he tries and fails to adapt 'The Orchid Thief' by Susan Orlean for the screen.
Black Hawk Down,"https://m.media-amazon.com/images/M/MV5BYWMwMzQxZjQtODM1YS00YmFiLTk1YjQtNzNiYWY1MDE4NTdiXkEyXkFqcGdeQXVyNDYyMDk5MTU@._V1_UX67_CR0,0,67,98_AL_.jpg","The story of 160 elite U.S. soldiers who dropped into Mogadishu in October 1993 to capture two top lieutenants of a renegade warlord, but found themselves in a desperate battle with a large force of heavily-armed Somalis."
Road to Perdition,"https://m.media-amazon.com/images/M/MV5BNjcxMmQ0MmItYTkzYy00MmUyLTlhOTQtMmJmNjE3MDMwYjdlXkEyXkFqcGdeQXVyNzkwMjQ5NzM@._V1_UX67_CR0,0,67,98_AL_.jpg","A mob enforcer's son in 1930s Illinois witnesses a murder, forcing him and his father to take to the road, and his father down a path of redemption and revenge."
Das Experiment,"https://m.media-amazon.com/images/M/MV5BNThiMDc1YjUtYmE3Zi00MTM1LTkzM2MtNjdlNzQ4ZDlmYjRmXkEyXkFqcGdeQXVyMTQxNzMzNDI@._V1_UY98_CR1,0,67,98_AL_.jpg","For two weeks, 20 male participants are hired to play prisoners and guards in a prison. The ""prisoners"" have to follow seemingly mild rules, and the ""guards"" are told to retain order without using physical violence."
Billy Elliot,"https://m.media-amazon.com/images/M/MV5BNGY3NWYwNzctNWU5Yi00ZjljLTgyNDgtZjNhZjRlNjc0ZTU1XkEyXkFqcGdeQXVyMTQxNzMzNDI@._V1_UX67_CR0,0,67,98_AL_.jpg",A talented young boy becomes torn between his unexpected love of dance and the disintegration of his family.
Hedwig and the Angry Inch,"https://m.media-amazon.com/images/M/MV5BZGY5NWUyNDUtZWJhZi00ZjMxLWFmMjMtYmJhZjVkZGZhNWQ4XkEyXkFqcGdeQXVyMTQxNzMzNDI@._V1_UX67_CR0,0,67,98_AL_.jpg",A gender-queer punk-rock singer from East Berlin tours the U.S. with her band as she tells her life story and follows the former lover/band-mate who stole her songs.
The Count of Monte Cristo,"https://m.media-amazon.com/images/M/MV5BMDM0ZWRjZDgtZWI0MS00ZTIzLTg4MWYtZjU5MDEyMDU0ODBjXkEyXkFqcGdeQXVyMTQxNzMzNDI@._V1_UX67_CR0,0,67,98_AL_.jpg","A young man, falsely imprisoned by his jealous ""friend"", escapes and uses a hidden treasure to exact his revenge."
Waking Life,"https://m.media-amazon.com/images/M/MV5BMWM0ZjY5ZjctODNkZi00Nzk0LWE1ODUtNGM4ZDUyMzUwMGYwXkEyXkFqcGdeQXVyMTQxNzMzNDI@._V1_UX67_CR0,0,67,98_AL_.jpg",A man shuffles through a dream meeting various people and discussing the meanings and purposes of the universe.
Ocean's Eleven,"https://m.media-amazon.com/images/M/MV5BYzVmYzVkMmUtOGRhMi00MTNmLThlMmUtZTljYjlkMjNkMjJkXkEyXkFqcGdeQXVyNDk3NzU2MTQ@._V1_UX67_CR0,0,67,98_AL_.jpg",Danny Ocean and his ten accomplices plan to rob three Las Vegas casinos simultaneously.
"O Brother, Where Art Thou?","https://m.media-amazon.com/images/M/MV5BMjZkOTdmMWItOTkyNy00MDdjLTlhNTQtYzU3MzdhZjA0ZDEyXkEyXkFqcGdeQXVyMTMxODk2OTU@._V1_UX67_CR0,0,67,98_AL_.jpg","In the deep south during the 1930s, three escaped convicts search for hidden treasure while a relentless lawman pursues them."
Minority Report,"https://m.media-amazon.com/images/M/MV5BZTI3YzZjZjEtMDdjOC00OWVjLTk0YmYtYzI2MGMwZjFiMzBlXkEyXkFqcGdeQXVyMTQxNzMzNDI@._V1_UX67_CR0,0,67,98_AL_.jpg","In a future where a special police unit is able to arrest murderers before they commit their crimes, an officer from that unit is himself accused of a future murder."
"South Park: Bigger, Longer & Uncut","https://m.media-amazon.com/images/M/MV5BOGE0ZWI0YzAtY2NkZi00YjkyLWIzYWEtNTJmMzJjODllNjdjXkEyXkFqcGdeQXVyMTQxNzMzNDI@._V1_UX67_CR0,0,67,98_AL_.jpg","When Stan Marsh and his friends go see an R-rated movie, they start cursing and their parents think that Canada is to blame."
Office Space,"https://m.media-amazon.com/images/M/MV5BOTA5MzQ3MzI1NV5BMl5BanBnXkFtZTgwNTcxNTYxMTE@._V1_UX67_CR0,0,67,98_AL_.jpg",Three company workers who hate their jobs decide to rebel against their greedy boss.
Happiness,"https://m.media-amazon.com/images/M/MV5BM2FlNzE0ZmUtMmVkZS00MWQ3LWE4OWQtYjQwZjdhNzRmNWE2XkEyXkFqcGdeQXVyMTAwMzUyOTc@._V1_UX67_CR0,0,67,98_AL_.jpg","The lives of several individuals intertwine as they go about their lives in their own unique ways, engaging in acts society as a whole might find disturbing in a desperate search for human connection."
The Boondock Saints,"https://m.media-amazon.com/images/M/MV5BYzVmMTdjOTYtOTJkYS00ZTg2LWExNTgtNzA1N2Y0MDgwYWFhXkEyXkFqcGdeQXVyMTQxNzMzNDI@._V1_UX67_CR0,0,67,98_AL_.jpg",Two Irish Catholic brothers become vigilantes and wipe out Boston's criminal underworld in the name of God.
Training Day,"https://m.media-amazon.com/images/M/MV5BMDZkMTUxYWEtMDY5NS00ZTA5LTg3MTItNTlkZWE1YWRjYjMwL2ltYWdlL2ltYWdlXkEyXkFqcGdeQXVyMTQxNzMzNDI@._V1_UX67_CR0,0,67,98_AL_.jpg",A rookie cop spends his first day as a Los Angeles narcotics officer with a rogue detective who isn't what he appears to be.
As Good as It Gets,"https://m.media-amazon.com/images/M/MV5BNWMxZTgzMWEtMTU0Zi00NDc5LWFkZjctMzUxNDIyNzZiMmNjXkEyXkFqcGdeQXVyMTQxNzMzNDI@._V1_UX67_CR0,0,67,98_AL_.jpg","A single mother and waitress, a misanthropic author, and a gay artist form an unlikely friendship after the artist is assaulted in a robbery."
The Fifth Element,"https://m.media-amazon.com/images/M/MV5BZWFjYmZmZGQtYzg4YS00ZGE5LTgwYzAtZmQwZjQ2NDliMGVmXkEyXkFqcGdeQXVyNTUyMzE4Mzg@._V1_UY98_CR0,0,67,98_AL_.jpg","In the colorful future, a cab driver unwittingly becomes the central figure in the search for a legendary cosmic weapon to keep Evil and Mr. Zorg at bay."
Donnie Brasco,"https://m.media-amazon.com/images/M/MV5BYzMzMDZkYWEtODIzNS00YjI3LTkxNTktOWEyZGM3ZWI2MWM4XkEyXkFqcGdeQXVyNzkwMjQ5NzM@._V1_UX67_CR0,0,67,98_AL_.jpg","An FBI undercover agent infiltrates the mob and finds himself identifying more with the mafia life, at the expense of his regular one."
Shine,"https://m.media-amazon.com/images/M/MV5BNTNlZDhkNTMtYTExYS00NGRiLTlhZTItM2JlOWQ3MzE4YzdhXkEyXkFqcGdeQXVyNjc3MjQzNTI@._V1_UX67_CR0,0,67,98_AL_.jpg","Pianist David Helfgott, driven by his father and teachers, has a breakdown. Years later he returns to the piano, to popular if not critical acclaim."
Primal Fear,"https://m.media-amazon.com/images/M/MV5BZTM2NWI2OGYtYWNhMi00ZTlmLTg2ZTAtMmI5NWRjODA5YTE1XkEyXkFqcGdeQXVyODE2OTYwNTg@._V1_UX67_CR0,0,67,98_AL_.jpg","An altar boy is accused of murdering a priest, and the truth is buried several layers deep."
Sense and Sensibility,"https://m.media-amazon.com/images/M/MV5BNzk1MjU3MDQyMl5BMl5BanBnXkFtZTcwNjc1OTM2MQ@@._V1_UX67_CR0,0,67,98_AL_.jpg","Rich Mr. Dashwood dies, leaving his second wife and her three daughters poor by the rules of inheritance. The two eldest daughters are the title opposites."
Apollo 13,"https://m.media-amazon.com/images/M/MV5BMjc4MzZlNmQtN2ZlOS00OGQzLWI5YjEtNDQ2YmZlN2FjNTIxXkEyXkFqcGdeQXVyMjUzOTY1NTc@._V1_UX67_CR0,0,67,98_AL_.jpg",NASA must devise a strategy to return Apollo 13 to Earth safely after the spacecraft undergoes massive internal damage putting the lives of the three astronauts on board in jeopardy.
Clerks,"https://m.media-amazon.com/images/M/MV5BNzE1Njk0NmItNDhlMC00ZmFlLWI4ZTUtYTY4ZjgzNjkyMTU1XkEyXkFqcGdeQXVyMTQxNzMzNDI@._V1_UX67_CR0,0,67,98_AL_.jpg","A day in the lives of two convenience clerks named Dante and Randal as they annoy customers, discuss movies, and play hockey on the store roof."
Short Cuts,"https://m.media-amazon.com/images/M/MV5BZWY0ODc2NDktYmYxNS00MGZiLTk5YjktZjgwZWFhNDQ0MzNhXkEyXkFqcGdeQXVyNTI4MjkwNjA@._V1_UX67_CR0,0,67,98_AL_.jpg",The day-to-day lives of several suburban Los Angeles residents.
Philadelphia,"https://m.media-amazon.com/images/M/MV5BNDE0MWE1ZTMtOWFkMS00YjdiLTkwZTItMDljYjY3MjM0NTk5XkEyXkFqcGdeQXVyNDYyMDk5MTU@._V1_UX67_CR0,0,67,98_AL_.jpg","When a man with HIV is fired by his law firm because of his condition, he hires a homophobic small time lawyer as the only willing advocate for a wrongful dismissal suit."
The Muppet Christmas Carol,"https://m.media-amazon.com/images/M/MV5BN2Y0NWRkNWItZWEwNi00MDNlLWJmZDYtNTkwYzI5Nzg4MjVjXkEyXkFqcGdeQXVyMTMxODk2OTU@._V1_UX67_CR0,0,67,98_AL_.jpg",The Muppet characters tell their version of the classic tale of an old and bitter miser's redemption on Christmas Eve.
Malcolm X,"https://m.media-amazon.com/images/M/MV5BZDkzOTFmMTUtMmI2OS00MDE4LTg5YTUtODMwNDMzNmI5OGYwL2ltYWdlXkEyXkFqcGdeQXVyMTQxNzMzNDI@._V1_UY98_CR3,0,67,98_AL_.jpg","Biographical epic of the controversial and influential Black Nationalist leader, from his early life and career as a small-time gangster, to his ministry as a member of the Nation of Islam."
The Last of the Mohicans,"https://m.media-amazon.com/images/M/MV5BZDNiYmRkNDYtOWU1NC00NmMxLWFkNmUtMGI5NTJjOTJmYTM5XkEyXkFqcGdeQXVyNzQ1ODk3MTQ@._V1_UX67_CR0,0,67,98_AL_.jpg",Three trappers protect the daughters of a British Colonel in the midst of the French and Indian War.
Glengarry Glen Ross,"https://m.media-amazon.com/images/M/MV5BNTYzN2MxODMtMDBhOC00Y2M0LTgzMTItMzQ4NDIyYWIwMDEzL2ltYWdlL2ltYWdlXkEyXkFqcGdeQXVyNTc1NTQxODI@._V1_UX67_CR0,0,67,98_AL_.jpg",An examination of the machinations behind the scenes at a real estate office.
A Few Good Men,"https://m.media-amazon.com/images/M/MV5BMmRlZDQ1MmUtMzE2Yi00YTkxLTk1MGMtYmIyYWQwODcxYzRlXkEyXkFqcGdeQXVyNTI4MjkwNjA@._V1_UX67_CR0,0,67,98_AL_.jpg",Military lawyer Lieutenant Daniel Kaffee defends Marines accused of murder. They contend they were acting under orders.
Night on Earth,"https://m.media-amazon.com/images/M/MV5BOGNmMjBmZWEtOWYwZC00NGIzLTg0YWItMzkzMWMwOTU4YTViXkEyXkFqcGdeQXVyNzc5MjA3OA@@._V1_UX67_CR0,0,67,98_AL_.jpg",An anthology of 5 different cab drivers in 5 American and European cities and their remarkable fares on the same eventful night.
Fried Green Tomatoes,"https://m.media-amazon.com/images/M/MV5BOWQ1ZWE0MTQtMmEwOS00YjA3LTgyZTAtNjY5ODEyZTJjNDI2XkEyXkFqcGdeQXVyNjE5MjUyOTM@._V1_UX67_CR0,0,67,98_AL_.jpg",A housewife who is unhappy with her life befriends an old lady in a nursing home and is enthralled by the tales she tells of people she used to know.
Yume,"https://m.media-amazon.com/images/M/MV5BZWY3NDU0ZWUtMDdlYS00NmIwLTg4YjktN2M4YzAxOGZjNmI0XkEyXkFqcGdeQXVyMjUzOTY1NTc@._V1_UX67_CR0,0,67,98_AL_.jpg",A collection of tales based upon eight of director Akira Kurosawa's recurring dreams.
Miller's Crossing,"https://m.media-amazon.com/images/M/MV5BMTY2Njk3MTAzM15BMl5BanBnXkFtZTgwMTY5Mzk4NjE@._V1_UX67_CR0,0,67,98_AL_.jpg","Tom Reagan, an advisor to a Prohibition-era crime boss, tries to keep the peace between warring mobs but gets caught in divided loyalties."
Home Alone,"https://m.media-amazon.com/images/M/MV5BMzFkM2YwOTQtYzk2Mi00N2VlLWE3NTItN2YwNDg1YmY0ZDNmXkEyXkFqcGdeQXVyMTMxODk2OTU@._V1_UX67_CR0,0,67,98_AL_.jpg",An eight-year-old troublemaker must protect his house from a pair of burglars when he is accidentally left home alone by his family during Christmas vacation.
When Harry Met Sally...,"https://m.media-amazon.com/images/M/MV5BMjE0ODEwNjM2NF5BMl5BanBnXkFtZTcwMjU2Mzg3NA@@._V1_UX67_CR0,0,67,98_AL_.jpg","Harry and Sally have known each other for years, and are very good friends, but they fear sex would ruin the friendship."
Who Framed Roger Rabbit,"https://m.media-amazon.com/images/M/MV5BMDhiOTM2OTctODk3Ny00NWI4LThhZDgtNGQ4NjRiYjFkZGQzXkEyXkFqcGdeQXVyMTA0MjU0Ng@@._V1_UX67_CR0,0,67,98_AL_.jpg",A toon-hating detective is a cartoon rabbit's only hope to prove his innocence when he is accused of murder.
Spoorloos,"https://m.media-amazon.com/images/M/MV5BNzczMWJlYTktMjJiZS00Y2ZjLTlhMWItMDg2NWFmZDY3YjdiXkEyXkFqcGdeQXVyNjUxMDQ0MTg@._V1_UX67_CR0,0,67,98_AL_.jpg","Rex and Saskia, a young couple in love, are on vacation. They stop at a busy service station and Saskia is abducted. After three years and no sign of Saskia, Rex begins receiving letters from the abductor."
The Last Emperor,"https://m.media-amazon.com/images/M/MV5BZTk0NDU4YmItOTk0ZS00ODc2LTkwNGItNWI5MDJkNTJiYWMxXkEyXkFqcGdeQXVyNjUwNzk3NDc@._V1_UX67_CR0,0,67,98_AL_.jpg",The story of the final Emperor of China.
Evil Dead II,"https://m.media-amazon.com/images/M/MV5BMWY3ODZlOGMtNzJmOS00ZTNjLWI3ZWEtZTJhZTk5NDZjYWRjXkEyXkFqcGdeQXVyNjU0OTQ0OTY@._V1_UX67_CR0,0,67,98_AL_.jpg",The lone survivor of an onslaught of flesh-possessing spirits holes up in a cabin with a group of strangers while the demons continue their attack.
Empire of the Sun,"https://m.media-amazon.com/images/M/MV5BMmQwNzczZDItNmI0OS00MjRmLTliYWItZWIyMjk1MTU4ZTQ4L2ltYWdlXkEyXkFqcGdeQXVyNTAyODkwOQ@@._V1_UX67_CR0,0,67,98_AL_.jpg",A young English boy struggles to survive under Japanese occupation of China during World War II.
Down by Law,"https://m.media-amazon.com/images/M/MV5BNmQ2ZGVlZTctZDllYy00YTVlLTk0ZWEtM2Y4ZjhjNGU0MzU3XkEyXkFqcGdeQXVyMjUzOTY1NTc@._V1_UX67_CR0,0,67,98_AL_.jpg","Two men are framed and sent to jail, where they meet a murderer who helps them escape and leave the state."
